contract_award_unique_key,award_id_piid,disaster_emergency_fund_codes,total_obligated_amount,total_outlayed_amount,current_total_value_of_award,potential_total_value_of_award,award_base_action_date,award_base_action_date_fiscal_year,award_latest_action_date,award_latest_action_date_fiscal_year,period_of_performance_start_date,period_of_performance_current_end_date,period_of_performance_potential_end_date,awarding_agency_code,awarding_agency_name,awarding_sub_agency_code,awarding_sub_agency_name,awarding_office_code,awarding_office_name,funding_agency_code,funding_agency_name,funding_sub_agency_code,funding_sub_agency_name,funding_office_code,funding_office_name,treasury_accounts_funding_this_award,federal_accounts_funding_this_award,object_classes_funding_this_award,program_activities_funding_this_award,foreign_funding,foreign_funding_description,recipient_uei,recipient_name,recipient_name_raw,cage_code,recipient_parent_uei,recipient_parent_name,recipient_parent_name_raw,recipient_country_code,recipient_country_name,recipient_address_line_1,recipient_city_name,prime_award_summary_recipient_county_fips_code,recipient_county_name,prime_award_summary_recipient_state_fips_code,recipient_state_code,recipient_state_name,recipient_zip_4_code,prime_award_summary_recipient_cd_original,prime_award_summary_recipient_cd_current,recipient_phone_number,primary_place_of_performance_country_code,primary_place_of_performance_country_name,primary_place_of_performance_city_name,prime_award_summary_place_of_performance_county_fips_code,primary_place_of_performance_county_name,prime_award_summary_place_of_performance_state_fips_code,primary_place_of_performance_state_code,primary_place_of_performance_state_name,primary_place_of_performance_zip_4,prime_award_summary_place_of_performance_cd_original,prime_award_summary_place_of_performance_cd_current,award_or_idv_flag,award_type_code,award_type,type_of_contract_pricing_code,type_of_contract_pricing,prime_award_base_transaction_description,solicitation_identifier,number_of_actions,inherently_governmental_functions,inherently_governmental_functions_description,product_or_service_code,product_or_service_code_description,contract_bundling_code,contract_bundling,naics_code,naics_description,recovered_materials_sustainability_code,recovered_materials_sustainability,domestic_or_foreign_entity_code,domestic_or_foreign_entity,epa_designated_product_code,epa_designated_product,country_of_product_or_service_origin_code,country_of_product_or_service_origin,place_of_manufacture_code,place_of_manufacture,subcontracting_plan_code,subcontracting_plan,extent_competed_code,extent_competed,solicitation_procedures_code,solicitation_procedures,type_of_set_aside_code,type_of_set_aside,evaluated_preference_code,evaluated_preference,research_code,research,number_of_offers_received,commercial_item_acquisition_procedures_code,commercial_item_acquisition_procedures,small_business_competitiveness_demonstration_program,simplified_procedures_for_certain_commercial_items_code,simplified_procedures_for_certain_commercial_items,a76_fair_act_action_code,a76_fair_act_action,fed_biz_opps_code,fed_biz_opps,local_area_set_aside_code,local_area_set_aside,price_evaluation_adjustment_preference_percent_difference,clinger_cohen_act_planning_code,clinger_cohen_act_planning,materials_supplies_articles_equipment_code,materials_supplies_articles_equipment,labor_standards_code,labor_standards,construction_wage_rate_requirements_code,construction_wage_rate_requirements,interagency_contracting_authority_code,interagency_contracting_authority,major_program,national_interest_action_code,national_interest_action,cost_or_pricing_data_code,cost_or_pricing_data,cost_accounting_standards_clause_code,cost_accounting_standards_clause,government_furnished_property_code,government_furnished_property,consolidated_contract_code,consolidated_contract,performance_based_service_acquisition_code,performance_based_service_acquisition,multi_year_contract_code,multi_year_contract,purchase_card_as_payment_method_code,purchase_card_as_payment_method,contingency_humanitarian_or_peacekeeping_operation_code,contingency_humanitarian_or_peacekeeping_operation,alaskan_native_corporation_owned_firm,american_indian_owned_business,indian_tribe_federally_recognized,native_hawaiian_organization_owned_firm,tribally_owned_firm,veteran_owned_business,service_disabled_veteran_owned_business,woman_owned_business,women_owned_small_business,economically_disadvantaged_women_owned_small_business,joint_venture_women_owned_small_business,joint_venture_economic_disadvantaged_women_owned_small_bus,minority_owned_business,subcontinent_asian_asian_indian_american_owned_business,asian_pacific_american_owned_business,black_american_owned_business,hispanic_american_owned_business,native_american_owned_business,other_minority_owned_business,contracting_officers_determination_of_business_size,contracting_officers_determination_of_business_size_code,emerging_small_business,community_developed_corporation_owned_firm,labor_surplus_area_firm,us_federal_government,federally_funded_research_and_development_corp,federal_agency,us_state_government,us_local_government,city_local_government,county_local_government,inter_municipal_local_government,local_government_owned,municipality_local_government,school_district_local_government,township_local_government,us_tribal_government,foreign_government,organizational_type,corporate_entity_not_tax_exempt,corporate_entity_tax_exempt,partnership_or_limited_liability_partnership,sole_proprietorship,small_agricultural_cooperative,international_organization,us_government_entity,community_development_corporation,domestic_shelter,educational_institution,foundation,hospital_flag,manufacturer_of_goods,veterinary_hospital,hispanic_servicing_institution,receives_contracts,receives_financial_assistance,receives_contracts_and_financial_assistance,airport_authority,council_of_governments,housing_authorities_public_tribal,interstate_entity,planning_commission,port_authority,transit_authority,subchapter_scorporation,limited_liability_corporation,foreign_owned,for_profit_organization,nonprofit_organization,other_not_for_profit_organization,the_ability_one_program,private_university_or_college,state_controlled_institution_of_higher_learning,1862_land_grant_college,1890_land_grant_college,1994_land_grant_college,minority_institution,historically_black_college,tribal_college,alaskan_native_servicing_institution,native_hawaiian_servicing_institution,school_of_forestry,veterinary_college,dot_certified_disadvantage,self_certified_small_disadvantaged_business,small_disadvantaged_business,c8a_program_participant,historically_underutilized_business_zone_hubzone_firm,sba_certified_8a_joint_venture,usaspending_permalink,last_modified_date,solicitation_date,sam_exception_description,recipient_duns,recipient_parent_duns,recipient_address_line_2,recipient_fax_number,type_of_idc,dod_claimant_program_code,dod_claimant_program_description,dod_acquisition_program_code,dod_acquisition_program_description,information_technology_commercial_item_category_code,information_technology_commercial_item_category,fair_opportunity_limited_sources,sea_transportation_code,sea_transportation,contract_financing_code,contract_financing,highly_compensated_officer_1_name,highly_compensated_officer_1_amount,highly_compensated_officer_2_name,highly_compensated_officer_2_amount,highly_compensated_officer_5_name,highly_compensated_officer_5_amount,other_than_full_and_open_competition_code,other_than_full_and_open_competition,parent_award_agency_id,parent_award_agency_name,parent_award_id_piid,obligated_amount_from_COVID-19_supplementals,ordering_period_end_date,idv_type_code,idv_type,multiple_or_single_award_idv_code,multiple_or_single_award_idv,type_of_idc_code,fair_opportunity_limited_sources_code,other_statutory_authority,parent_award_type_code,parent_award_type,parent_award_single_or_multiple_code,parent_award_single_or_multiple,highly_compensated_officer_3_name,highly_compensated_officer_3_amount,highly_compensated_officer_4_name,highly_compensated_officer_4_amount,recipient_doing_business_as_name,program_acronym
CONT_AWD_75N93018C00034_7529_-NONE-_-NONE-,75N93018C00034,Q: Not Designated Nonemergency/Emergency/Disaster/Wildfire Suppression,305000.0,25416.0,305000.0,305000.0,2018-07-26,2018,2023-01-23,2023,2018-07-26,2019-12-31,2019-12-31 00:00:00,75,Department of Health and Human Services,7529,National Institutes of Health,75N930,NATIONAL INSTITUTES OF HEALTH NIAID,75,Department of Health and Human Services,7529,National Institutes of Health,75N930,NATIONAL INSTITUTES OF HEALTH NIAID,075-2018/2018-0885-000,075-0885,25.5: Research and development contracts,0006: NATIONAL INSTITUTE OF ALLERGY AND INFECTIOUS DISEASES (0885),X,NOT APPLICABLE,D2DDKPAALJR3,"MIRECULE, INC.","MIRECULE, INC.",7KWU3,QPKVJMFWNPS8,MIRECULE INC,MIRECULE INC,USA,UNITED STATES,22 BALTIMORE RD STE 100,ROCKVILLE,24031.0,MONTGOMERY,24,MD,MARYLAND,208504146,MD-06,MD-08,4432712258,USA,UNITED STATES,ROCKVILLE,24031.0,MONTGOMERY,24.0,MD,MARYLAND,208504146.0,MD-08,MD-08,AWARD,D,DEFINITIVE CONTRACT,J,FIRM FIXED PRICE,THE OBJECTIVE OF THIS CONTRACT IS TO DEVELOP CHEMICALLY MODIFIED MIMICS OF MICRORNAS WITH IMPROVED ACTIVITY AND STABILITY FOR THE TREATMENT OF MANY DISEASES.,SBIRPHS20181,1.0,OT,OTHER FUNCTIONS,AN12,HEALTH R&D SERVICES; HEALTH CARE SERVICES; APPLIED RESEARCH,H,NOT BUNDLED,541715,"RESEARCH AND DEVELOPMENT IN THE PHYSICAL, ENGINEERING, AND LIFE SCIENCES (EXCEPT NANOTECHNOLOGY AND BIOTECHNOLOGY)",C,NO CLAUSES INCLUDED AND NO SUSTAINABILITY INCLUDED,A,U.S. OWNED BUSINESS,E,NOT REQUIRED,USA,UNITED STATES,C,NOT A MANUFACTURED END PRODUCT,B,PLAN NOT REQUIRED,D,FULL AND OPEN COMPETITION AFTER EXCLUSION OF SOURCES,NP,NEGOTIATED PROPOSAL/QUOTE,SBA,SMALL BUSINESS SET ASIDE - TOTAL,NONE,NO PREFERENCE USED,SR1,SMALL BUSINESS INNOVATION RESEARCH PROGRAM PHASE I ACTION,3.0,D,COMMERCIAL PRODUCTS/SERVICES PROCEDURES NOT USED,f,N,NO,N,NO,Y,YES,N,NO,0.0,N,NO,X,NOT APPLICABLE,X,NOT APPLICABLE,X,NOT APPLICABLE,X,NOT APPLICABLE,DEVELOPMENT OF A CXCR4 TARGETED MIR-29B-3P MICRORNA MIMIC TO TREAT HIV,NONE,NONE,N,NO,X,NOT APPLICABLE EXEMPT FROM CAS,N,N,D,NOT CONSOLIDATED,N,NO - SERVICE WHERE PBA IS NOT USED.,N,NO,N,NO,X,NOT APPLICABLE,f,f,f,f,f,f,f,f,f,f,f,f,f,f,f,f,f,f,f,SMALL BUSINESS,S,f,f,f,f,f,f,f,f,f,f,f,f,f,f,f,f,f,CORPORATE NOT TAX EXEMPT,t,f,f,f,f,f,f,f,f,f,f,f,f,f,f,f,f,t,f,f,f,f,f,f,f,f,f,f,t,f,f,f,f,f,f,f,f,f,f,f,f,f,f,f,f,t,f,f,f,f,https://www.usaspending.gov/award/CONT_AWD_75N93018C00034_7529_-NONE-_-NONE-/,2023-01-27,,,,,,,,,,,,,,,,,,,,,,,,,,,,,,,,,,,,,,,,,,,,,,,,
CONT_AWD_DOCSB134112SU0644_1341_-NONE-_-NONE-,DOCSB134112SU0644,,54770.0,,,,2012-05-31,2012,2015-12-19,2016,2012-06-04,2013-06-03,2013-06-03 00:00:00,13,Department of Commerce,1341,National Institute of Standards and Technology,000SB,DEPT OF COMM/NAT INST STAND AND TECHNOL,13,Department of Commerce,1341,National Institute of Standards and Technology,000SB,DEPT OF COMM/NAT INST STAND AND TECHNOL,,,,,X,NOT APPLICABLE,DPHWXD86RNS4,N5 SENSORS INC,N5 SENSORS INC,,DPHWXD86RNS4,N5 SENSORS INC,N5 SENSORS INC,USA,UNITED STATES,"5800 INMAN PARK CIRCLE, STE 200",ROCKVILLE,24031.0,MONTGOMERY,24,MD,MARYLAND,208525483,MD-08,MD-08,3012576756,USA,UNITED STATES,GAITHERSBURG,24031.0,MONTGOMERY,24.0,MD,MARYLAND,208990001.0,MD-06,MD-06,AWARD,B,PURCHASE ORDER,J,FIRM FIXED PRICE,NANOSCALE STRUCTURES SUPPORT,,1.0,,,R405,SUPPORT- PROFESSIONAL: OPERATIONS RESEARCH/QUANTITATIVE ANALYSIS,D,NOT A BUNDLED REQUIREMENT,541690,OTHER SCIENTIFIC AND TECHNICAL CONSULTING SERVICES,C,NO CLAUSES INCLUDED AND NO SUSTAINABILITY INCLUDED,A,U.S. OWNED BUSINESS,E,NOT REQUIRED,USA,UNITED STATES,C,NOT A MANUFACTURED END PRODUCT,B,PLAN NOT REQUIRED,F,COMPETED UNDER SAP,SP1,SIMPLIFIED ACQUISITION,SBA,SMALL BUSINESS SET ASIDE - TOTAL,NONE,NO PREFERENCE USED,,,1.0,A,COMMERCIAL ITEM,f,N,NO,N,NO,N,NO,N,NO,,N,NO,X,NOT APPLICABLE,X,NOT APPLICABLE,X,NOT APPLICABLE,X,NOT APPLICABLE,,NONE,NONE,,,,,N,N,N,NO,N,NO - SERVICE WHERE PBA IS NOT USED.,,,N,NO,X,NOT APPLICABLE,f,f,f,f,f,f,f,f,f,f,f,f,f,f,f,f,f,f,f,SMALL BUSINESS,S,f,f,f,f,f,f,f,f,f,f,f,f,f,f,f,f,f,,t,f,f,f,f,f,f,f,f,f,f,f,f,f,f,f,f,t,f,f,f,f,f,f,f,t,f,f,t,f,f,f,f,f,f,f,f,f,f,f,f,f,f,f,f,f,f,f,f,f,https://www.usaspending.gov/award/CONT_AWD_DOCSB134112SU0644_1341_-NONE-_-NONE-/,2015-12-19,,,78386164.0,78386164.0,,8662998239.0,,,,,,,,,,,,,,,,,,,,,,,,,,,,,,,,,,,,,,,,,,
CONT_AWD_DOCSB134113SE0216_1341_-NONE-_-NONE-,DOCSB134113SE0216,,557922.11,,,,2013-04-12,2013,2016-10-27,2017,2013-04-12,2016-04-11,2016-04-11 00:00:00,13,Department of Commerce,1341,National Institute of Standards and Technology,1333ND,DEPT OF COMMERCE NIST,13,Department of Commerce,1341,National Institute of Standards and Technology,1333ND,DEPT OF COMMERCE NIST,,,,,X,NOT APPLICABLE,DPHWXD86RNS4,N5 SENSORS INC,N5 SENSORS INC,,DPHWXD86RNS4,N5 SENSORS INC,N5 SENSORS INC,USA,UNITED STATES,"5800 INMAN PARK CIRCLE, STE 200",ROCKVILLE,24031.0,MONTGOMERY,24,MD,MARYLAND,208525483,MD-08,MD-08,3012576756,USA,UNITED STATES,GAITHERSBURG,24031.0,MONTGOMERY,24.0,MD,MARYLAND,208990001.0,MD-06,MD-06,AWARD,B,PURCHASE ORDER,J,FIRM FIXED PRICE,"IGF::CL::IGF  FOR CLOSELY ASSOCIATED--METROLOGY FOR ELECTRO-OPTICAL STUDY OF 3D-NANOSTRUCTURED MATERIALS AND DEVICE PLATFORMS FOR PHOTOVOTAIC,SENSING AND PHOTODETECTOR APPLICATIONS",SB1341-13-RQ-0187,1.0,,,AG91,R&D- ENERGY: OTHER (BASIC RESEARCH),D,NOT A BUNDLED REQUIREMENT,541712,"RESEARCH AND DEVELOPMENT IN THE PHYSICAL, ENGINEERING, AND LIFE SCIENCES (EXCEPT BIOTECHNOLOGY)",C,NO CLAUSES INCLUDED AND NO SUSTAINABILITY INCLUDED,A,U.S. OWNED BUSINESS,E,NOT REQUIRED,USA,UNITED STATES,C,NOT A MANUFACTURED END PRODUCT,B,PLAN NOT REQUIRED,F,COMPETED UNDER SAP,SP1,SIMPLIFIED ACQUISITION,SBA,SMALL BUSINESS SET ASIDE - TOTAL,NONE,NO PREFERENCE USED,,,2.0,A,COMMERCIAL ITEM,f,Y,YES,N,NO,Y,YES,N,NO,,N,NO,N,NO,Y,YES,N,NO,X,NOT APPLICABLE,,NONE,NONE,,,,,N,N,N,NO,N,NO - SERVICE WHERE PBA IS NOT USED.,,,N,NO,X,NOT APPLICABLE,f,f,f,f,f,f,f,f,f,f,f,f,f,f,f,f,f,f,f,SMALL BUSINESS,S,f,f,f,f,f,f,f,f,f,f,f,f,f,f,f,f,f,,t,f,f,f,f,f,f,f,f,f,f,f,f,f,f,f,f,t,f,f,f,f,f,f,f,t,f,f,t,f,f,f,f,f,f,f,f,f,f,f,f,f,f,f,f,f,f,f,f,f,https://www.usaspending.gov/award/CONT_AWD_DOCSB134113SE0216_1341_-NONE-_-NONE-/,2016-10-27,,,78386164.0,78386164.0,,8662998239.0,,,,,,,,,,,,,,,,,,,,,,,,,,,,,,,,,,,,,,,,,,
CONT_AWD_EPD14016_6800_-NONE-_-NONE-,EPD14016,,99190.97,,,,2014-04-10,2014,2015-01-06,2015,2014-05-01,2014-10-31,2014-10-31 00:00:00,68,Environmental Protection Agency,6800,Environmental Protection Agency,DCO00,RTP PROCUREMENT OPERATIONS DIVISION (RTPPOD),68,Environmental Protection Agency,6800,Environmental Protection Agency,6840,OFFICE FOR RESEARCH AND DEVELOPMENT (ORD),,,,,,NOT APPLICABLE,DPHWXD86RNS4,N5 SENSORS INC,N5 SENSORS INC,,DPHWXD86RNS4,N5 SENSORS INC,N5 SENSORS INC,USA,UNITED STATES,18008 COTTAGE GARDEN DR APT 302,GERMANTOWN,,,24,MD,,208745820,MD-06,MD-06,3012576756,USA,UNITED STATES,GERMANTOWN,24031.0,MONTGOMERY,24.0,MD,MARYLAND,208745820.0,MD-06,MD-06,AWARD,D,DCA,J,FIRM FIXED PRICE,"IGF::OT::IGF LOW-POWER, SMALL FORM-FACTOR BENZENE SENSOR FOR MOBILE DEVICES BASED EXPOSURE MONITORING",,1.0,,,AJ33,R&D- GENERAL SCIENCE/TECHNOLOGY: ENVIRONMENTAL SCIENCES (ADVANCED DEVELOPMENT),D,NOT A BUNDLED REQUIREMENT,541712,"RESEARCH AND DEVELOPMENT IN THE PHYSICAL, ENGINEERING, AND LIFE SCIENCES (EXCEPT BIOTECHNOLOGY)",B,FAR 52.223-4 AND FAR 52.223-9 INCLUDED,A,U.S. OWNED BUSINESS,A,MEETS REQUIREMENTS,USA,,C,NOT A MANUFACTURED END PRODUCT,B,PLAN NOT REQUIRED,D,FULL AND OPEN COMPETITION AFTER EXCLUSION OF SOURCES,NP,NEGOTIATED PROPOSAL/QUOTE,SBA,SMALL BUSINESS SET ASIDE - TOTAL,NONE,NO PREFERENCE USED,SR1,SMALL BUSINESS INNOVATION RESEARCH PROGRAM PHASE I ACTION,257.0,D,,f,N,NO,NO,,X,NOT APPLICABLE,N,,0.0,N: NO,,X,NOT APPLICABLE,X,NOT APPLICABLE,X,NOT APPLICABLE,X,NOT APPLICABLE,"LOW-POWER, SMALL FORM FACTOR BENZENE SENSOR FOR MO",NONE,NONE,N,NO,X,NOT APPLICABLE EXEMPT FROM CAS,N,N,N,NO,N,NO - SERVICE WHERE PBA IS NOT USED.,N,NO,N,NO,X,NOT APPLICABLE,f,f,f,f,f,f,f,f,f,f,f,f,f,f,f,f,f,f,f,SMALL BUSINESS,S,f,f,f,f,f,f,f,f,f,f,f,f,f,f,f,f,f,,t,f,f,f,f,f,f,f,f,f,f,f,f,f,f,t,t,t,f,f,f,f,f,f,f,t,f,f,t,f,f,f,f,f,f,f,f,f,f,f,f,f,f,f,f,f,f,f,f,f,https://www.usaspending.gov/award/CONT_AWD_EPD14016_6800_-NONE-_-NONE-/,2015-01-06,,NAN,78386164.0,78386164.0,,8662998239.0,NAN,,,,,,,NAN,,,,,,,,,,,,,,,,,,,,,,,,,,,,,,,,,,
CONT_AWD_HSHQDC14C00066_7001_-NONE-_-NONE-,HSHQDC14C00066,,99735.71,,,,2014-08-27,2014,2014-08-27,2014,2014-08-27,2015-02-28,2015-02-28 00:00:00,70,Department of Homeland Security,7001,Office of Procurement Operations,DNDO00,DOMESTIC NUCLEAR DETECTION OFFICE ACQUISITION DIVISION,70,Department of Homeland Security,7001,Office of Procurement Operations,SCST,DIRECTORATE FOR SCIENCE AND TECHNOLOGY,,,,,,NOT APPLICABLE,DPHWXD86RNS4,N5 SENSORS INC,N5 SENSORS INC,,DPHWXD86RNS4,N5 SENSORS INC,N5 SENSORS INC,USA,UNITED STATES,18008 COTTAGE GARDEN DR APT 302,GERMANTOWN,,,24,MD,,208745820,MD-06,MD-06,3012576756,USA,UNITED STATES,GERMANTOWN,24031.0,MONTGOMERY,24.0,MD,MARYLAND,208745820.0,MD-06,MD-06,AWARD,D,DCA,J,FIRM FIXED PRICE,IGF::OT::IGF  NEW SBIR PHASE I CONTRACT,,1.0,,,AZ11,R&D- OTHER RESEARCH AND DEVELOPMENT (BASIC RESEARCH),D,NOT A BUNDLED REQUIREMENT,541712,"RESEARCH AND DEVELOPMENT IN THE PHYSICAL, ENGINEERING, AND LIFE SCIENCES (EXCEPT BIOTECHNOLOGY)",C,NO CLAUSES INCLUDED AND NO SUSTAINABILITY INCLU,A,U.S. OWNED BUSINESS,E,NOT REQUIRED,USA,,C,NOT A MANUFACTURED END PRODUCT,B,PLAN NOT REQUIRED,D,FULL AND OPEN COMPETITION AFTER EXCLUSION OF SOURCES,NP,NEGOTIATED PROPOSAL/QUOTE,SBA,SMALL BUSINESS SET ASIDE - TOTAL,NONE,NO PREFERENCE USED,SR1,SMALL BUSINESS INNOVATION RESEARCH PROGRAM PHASE I ACTION,88.0,D,,f,N,NO,NO,,N,NO,N,,0.0,N: NO,,N,NO,N,NO,N,NO,X,NOT APPLICABLE,,NONE,NONE,N,NO,X,NOT APPLICABLE EXEMPT FROM CAS,N,N,N,NO,N,NO - SERVICE WHERE PBA IS NOT USED.,N,NO,N,NO,X,NOT APPLICABLE,f,f,f,f,f,f,f,f,f,f,f,f,f,f,f,f,f,f,f,SMALL BUSINESS,S,f,f,f,f,f,f,f,f,f,f,f,f,f,f,f,f,f,,t,f,f,f,f,f,f,f,f,f,f,f,f,f,f,t,t,t,f,f,f,f,f,f,f,t,f,f,t,f,f,f,f,f,f,f,f,f,f,f,f,f,f,f,f,f,f,f,f,f,https://www.usaspending.gov/award/CONT_AWD_HSHQDC14C00066_7001_-NONE-_-NONE-/,2014-08-27,,NAN,78386164.0,78386164.0,,8662998239.0,NAN,,,,,,,NAN,,,,,,,,,,,,,,,,,,,,,,,,,,,,,,,,,,
CONT_AWD_HSHQDC15C00075_7001_-NONE-_-NONE-,HSHQDC15C00075,,1190564.36,,1190564.36,1190564.36,2015-09-04,2015,2020-09-11,2020,2015-09-04,2019-12-31,2019-12-31 00:00:00,70,Department of Homeland Security,7001,Office of Procurement Operations,70RSAT,SCI&TECH ACQ DIV,70,Department of Homeland Security,7040,Office of the Under Secretary for Science and Technology,70YSA1,OFF OF THE USCTY FOR SCIENCE&TECH,070-2018/2020-0803-000;070-2019/2021-0803-000,070-0803,25.5: Research and development contracts,,X,NOT APPLICABLE,DPHWXD86RNS4,N5 SENSORS INC,N5 SENSORS INC,6NMY3,DPHWXD86RNS4,N5 SENSORS INC,N5 SENSORS INC,USA,UNITED STATES,18008 COTTAGE GARDEN DR APT 302,GERMANTOWN,24031.0,MONTGOMERY,24,MD,MARYLAND,208745820,MD-06,MD-06,6187519782,USA,UNITED STATES,GERMANTOWN,24031.0,MONTGOMERY,24.0,MD,MARYLAND,208745820.0,MD-06,MD-06,AWARD,D,DEFINITIVE CONTRACT,J,FIRM FIXED PRICE,IGF::OT::IGF FIELD DETECTION AND ANALYSIS FOR FIRE GASES AND PARTICULATES PHASE II,HSHQDC-14-R-00035,1.0,OT,OTHER FUNCTIONS,AJ42,R&D- GENERAL SCIENCE/TECHNOLOGY: ENGINEERING (APPLIED RESEARCH/EXPLORATORY DEVELOPMENT),D,NOT A BUNDLED REQUIREMENT,541712,"RESEARCH AND DEVELOPMENT IN THE PHYSICAL, ENGINEERING, AND LIFE SCIENCES (EXCEPT BIOTECHNOLOGY)",C,NO CLAUSES INCLUDED AND NO SUSTAINABILITY INCLUDED,A,U.S. OWNED BUSINESS,E,NOT REQUIRED,USA,UNITED STATES,C,NOT A MANUFACTURED END PRODUCT,B,PLAN NOT REQUIRED,D,FULL AND OPEN COMPETITION AFTER EXCLUSION OF SOURCES,NP,NEGOTIATED PROPOSAL/QUOTE,SBA,SMALL BUSINESS SET ASIDE - TOTAL,NONE,NO PREFERENCE USED,,,3.0,D,COMMERCIAL ITEM PROCEDURES NOT USED,f,N,NO,N,NO,Y,YES,N,NO,0.0,N,NO,X,NOT APPLICABLE,X,NOT APPLICABLE,X,NOT APPLICABLE,X,NOT APPLICABLE,,NONE,NONE,N,NO,X,NOT APPLICABLE EXEMPT FROM CAS,N,N,N,NO,N,NO - SERVICE WHERE PBA IS NOT USED.,N,NO,N,NO,X,NOT APPLICABLE,f,f,f,f,f,f,f,f,f,f,f,f,f,f,f,f,f,f,f,SMALL BUSINESS,S,f,f,f,f,f,f,f,f,f,f,f,f,f,f,f,f,f,CORPORATE NOT TAX EXEMPT,t,f,f,f,f,f,f,f,f,f,f,f,f,f,f,f,f,t,f,f,f,f,f,f,f,t,f,f,t,f,f,f,f,f,f,f,f,f,f,f,f,f,f,f,f,f,f,f,f,f,https://www.usaspending.gov/award/CONT_AWD_HSHQDC15C00075_7001_-NONE-_-NONE-/,2020-09-14,,,78386164.0,78386164.0,,8662998239.0,,,,,,,,,,,,,,,,,,,,,,,,,,,,,,,,,,,,,,,,,,
CONT_AWD_HSHQDC17C00056_7001_-NONE-_-NONE-,HSHQDC17C00056,,193527.35,,193527.35,193527.35,2017-09-27,2017,2019-08-02,2019,2017-09-27,2018-09-26,2018-09-26 00:00:00,70,Department of Homeland Security,7001,Office of Procurement Operations,70RSAT,SCI  TECH ACQ DIV,70,Department of Homeland Security,7040,Office of the Under Secretary for Science and Technology,70YSA1,OFF OF THE USCTY FOR SCIENCE  TECH,070-2017/2019-0803-000,070-0803,25.5: Research and development contracts,,X,NOT APPLICABLE,DPHWXD86RNS4,N5 SENSORS INC,N5 SENSORS INC,6NMY3,DPHWXD86RNS4,N5 SENSORS INC,N5 SENSORS INC,USA,UNITED STATES,18008 COTTAGE GARDEN DR APT 302,GERMANTOWN,24031.0,MONTGOMERY,24,MD,MARYLAND,208745820,MD-06,MD-06,3012576756,USA,UNITED STATES,GERMANTOWN,24031.0,MONTGOMERY,24.0,MD,MARYLAND,208745820.0,MD-06,MD-06,AWARD,D,DEFINITIVE CONTRACT,J,FIRM FIXED PRICE,"IGF::OT::IGF DEPARTMENT OF HOMELAND SECURITY, SCIENCE AND TECHNOLOGY, FY17 COMMERCIALIZATION READINESS PILOT PROGRAM (CRPP) PROPOSAL TITLE: FIELD DETECTION AND ANALYSIS FOR FIRE GASES AND PARTICULATES",HSHQDC-14-R-00035,1.0,OT,OTHER FUNCTIONS,AZ11,R&D- OTHER RESEARCH AND DEVELOPMENT (BASIC RESEARCH),H,NOT BUNDLED,541712,"RESEARCH AND DEVELOPMENT IN THE PHYSICAL, ENGINEERING, AND LIFE SCIENCES (EXCEPT BIOTECHNOLOGY)",C,NO CLAUSES INCLUDED AND NO SUSTAINABILITY INCLUDED,A,U.S. OWNED BUSINESS,E,NOT REQUIRED,USA,UNITED STATES,C,NOT A MANUFACTURED END PRODUCT,B,PLAN NOT REQUIRED,D,FULL AND OPEN COMPETITION AFTER EXCLUSION OF SOURCES,NP,NEGOTIATED PROPOSAL/QUOTE,SBA,SMALL BUSINESS SET ASIDE - TOTAL,NONE,NO PREFERENCE USED,SR2,SMALL BUSINESS INNOVATION RESEARCH PROGRAM PHASE II ACTION,1.0,D,COMMERCIAL ITEM PROCEDURES NOT USED,f,N,NO,N,NO,X,NOT APPLICABLE,N,NO,0.0,N,NO,X,NOT APPLICABLE,X,NOT APPLICABLE,X,NOT APPLICABLE,X,NOT APPLICABLE,,NONE,NONE,N,NO,X,NOT APPLICABLE EXEMPT FROM CAS,N,N,D,NOT CONSOLIDATED,N,NO - SERVICE WHERE PBA IS NOT USED.,N,NO,N,NO,X,NOT APPLICABLE,f,f,f,f,f,f,f,f,f,f,f,f,f,f,f,f,f,f,f,SMALL BUSINESS,S,f,f,f,f,f,f,f,f,f,f,f,f,f,f,f,f,f,CORPORATE NOT TAX EXEMPT,t,f,f,f,f,f,f,f,f,f,f,f,f,f,f,f,f,t,f,f,f,f,f,f,f,t,f,f,t,f,f,f,f,f,f,f,f,f,f,f,f,f,f,f,f,f,f,f,f,f,https://www.usaspending.gov/award/CONT_AWD_HSHQDC17C00056_7001_-NONE-_-NONE-/,2019-09-16,,,78386164.0,78386164.0,,,,,,,,,,,,,,,,,,,,,,,,,,,,,,,,,,,,,,,,,,,,
