Company Name,uei,award_title,agency,branch,phase,program,agency_tracking_number,contract,proposal_award_date,contract_end_date,solicitation_number,solicitation_year,topic_code,award_year,award_amount,award_link
TELOHEALTHDX LLC,ZWK6WMUV43G5,Single telomere length analysis using DNA array and FISH: a low-cost and accurate test for telomere-associated diseases,HHS,NIH,Phase I,STTR,R41AG085701,1R41AG085701-01,2024-09-25,2025-08-31,PA22-178,2022,R,2024,448961.0000,212837
Sorbenta Inc,JBJ7EF1MD9P1,Novel sorbents for removal of PFAS from water,HHS,NIH,Phase I,STTR,R41ES036472,1R41ES036472-01,2024-07-13,2025-06-30,PA23-232,2023,113,2024,295923.0000,212935
Sorbenta Inc,JBJ7EF1MD9P1,Novel sorbents for removal of PFAS from water,HHS,NIH,Phase I,STTR,R41ES036472,1R41ES036472-01,2024-07-13,2025-06-30,PA23-232,2023,113,2024,295923.0000,212935
Sorbenta Inc,JBJ7EF1MD9P1,Novel sorbents for removal of PFAS from water,HHS,NIH,Phase I,STTR,R41ES036472,1R41ES036472-01,2024-07-13,2025-06-30,PA23-232,2023,113,2024,295923.0000,212935
"Predictive, LLC",LDHKC12HSJ86,Development of a web-based platform implementing novel Predictor of Toxicity for Medical Devices (PredTox/MD),HHS,NIH,Phase II,SBIR,R44ES032371,2R44ES032371-02A1,2024-01-25,2025-12-31,PA22-176,2022,NIEHS,2024,898248.0000,213719
"Predictive, LLC",LDHKC12HSJ86,Artificial Intelligence Toolkit for Predicting Mixture Toxicity,HHS,NIH,Phase I,STTR,R41ES033857,1R41ES033857-01,2021-12-20,2022-11-30,ES21-003,2021,R,2022,255538.0000,197696
"Predictive, LLC",LDHKC12HSJ86,STopTox: A comprehensive in silico platform for predicting systemic and topical toxicity,HHS,NIH,Phase I,STTR,R41ES033589,1R41ES033589-01,2021-08-13,2022-07-31,PA20-265,2020,NIEHS,2021,255537.0000,193783
"Predictive, LLC",LDHKC12HSJ86,Development of a web-based platform implementing novel Predictor of Skin Sensitization for Medical Devices (PreSS/MD),HHS,NIH,Phase I,SBIR,R43ES032371,1R43ES032371-01,2020-09-09,2021-08-31,PA19-272,2019,R,2020,167910.0000,183260
"Predictive, LLC",LDHKC12HSJ86,SBIR 136 - PREDICTIVE: Knowledge Graphs for Infectious Diseases,HHS,NIH,Phase I,SBIR,75N93024C00038-0-9999-0,75N93024C00038,,,PHS-2024-1,2024,136,2024,298262.0000,214725
"Predictive, LLC",LDHKC12HSJ86,Development of a web-based platform implementing novel Predictor of Toxicity for Medical Devices (PredTox/MD),HHS,NIH,Phase II,SBIR,R44ES032371,2R44ES032371-02A1,2024-01-25,2025-12-31,PA22-176,2022,NIEHS,2024,898248.0000,213719
"Predictive, LLC",LDHKC12HSJ86,Artificial Intelligence Toolkit for Predicting Mixture Toxicity,HHS,NIH,Phase I,STTR,R41ES033857,1R41ES033857-01,2021-12-20,2022-11-30,ES21-003,2021,R,2022,255538.0000,197696
"Predictive, LLC",LDHKC12HSJ86,STopTox: A comprehensive in silico platform for predicting systemic and topical toxicity,HHS,NIH,Phase I,STTR,R41ES033589,1R41ES033589-01,2021-08-13,2022-07-31,PA20-265,2020,NIEHS,2021,255537.0000,193783
"Predictive, LLC",LDHKC12HSJ86,Development of a web-based platform implementing novel Predictor of Skin Sensitization for Medical Devices (PreSS/MD),HHS,NIH,Phase I,SBIR,R43ES032371,1R43ES032371-01,2020-09-09,2021-08-31,PA19-272,2019,R,2020,167910.0000,183260
"Predictive, LLC",LDHKC12HSJ86,SBIR 136 - PREDICTIVE: Knowledge Graphs for Infectious Diseases,HHS,NIH,Phase I,SBIR,75N93024C00038-0-9999-0,75N93024C00038,,,PHS-2024-1,2024,136,2024,298262.0000,214725
AXNANO LLC,NMDVSFDSVCB4,Reclaiming Beneficial Biosolids : A PFAS Removal and Destruction Approach,EPA,,Phase I,SBIR,B251B-0002,68HERC25C0011,2024-12-16,2025-06-15,68HERC24R0185,2025,1B,2025,100000.0000,214929
AXNANO LLC,NMDVSFDSVCB4,Mobile System for the Responsible Treatment ofĀArmy Waste Streams,DOD,ARMY,Phase II,SBIR,A2D-1359,W51701-24-C-0168,2024-07-18,2026-01-05,23.4,2023,A234-P015,2024,1899717.0700,209640
AXNANO LLC,NMDVSFDSVCB4,A Mobile Water Purification System for Improving Army's Water Stewardship,DOD,ARMY,Phase I,SBIR,A234-P014-1063,W51701-23-C-0236,2023-09-07,2024-03-15,23.4,2023,A234-P014,2023,249886.2200,207149
AXNANO LLC,NMDVSFDSVCB4,"Sustainable, Non-Incineration-based Destruction of Air Force Hazardous Waste Stockpiles",DOD,USAF,Phase II,SBIR,FX224-OCSO1-0896,FA8649-23-P-1125,2023-07-21,2025-04-21,X22.4,2022,X224-OCSO1,2023,1236627.0000,205843
AXNANO LLC,NMDVSFDSVCB4,mSCWO For On-Site Complete Destruction Of Air Force Hazardous Waste Stockpiles,DOD,USAF,Phase I,SBIR,FX224-OCSO1-0896,FA8649-23-P-0100,2022-11-04,2023-02-04,X22.4,2022,X224-OCSO1,2023,74943.0000,204781
AXNANO LLC,NMDVSFDSVCB4,Mobile PFAS Effluent Treatment System (PETS) for management of Air Force wastes,DOD,USAF,Phase I,SBIR,FX224-OCSO1-1101,FA8649-23-P-0219,2022-11-03,2023-02-04,X22.4,2022,X224-OCSO1,2023,74983.0000,204874
AXNANO LLC,NMDVSFDSVCB4,Reactive Bimetallic-Carbon Media For Destruction Of PFAS-Containing AFFF Wastes,DOD,USAF,Phase II,SBIR,FX203-CSO1-0925,FA864922P0013,2021-10-18,2023-01-18,X20.3,2020,AF203-CSO1,2022,749368.0000,194959
AXNANO LLC,NMDVSFDSVCB4,Development of a Smart PFAS-Collector for High-Throughput PFAS Detection,HHS,NIH,Phase I,SBIR,R43ES033585,1R43ES033585-01,2021-09-01,2022-08-31,PA20-260,2020,NIEHS,2021,168087.0000,193974
AXNANO LLC,NMDVSFDSVCB4,Reactive Bimetallic-Carbon Media for Destruction of PFAS-containing Aqueous Fire Fighting Foam Stockpiles,DOD,USAF,Phase I,SBIR,FX203-CSO1-0925,FA8649-21-P-0368,2021-02-05,2021-05-03,X20.3,2020,AF203-CSO1,2021,49999.2200,191275
AXNANO LLC,NMDVSFDSVCB4,Hydraulic Fracturing of Controlled Release Oxidants for Remediation of Low Permeability Zones,HHS,NIH,Phase II,SBIR,R44ES031461,4R44ES031461-02,2020-09-09,2022-08-31,PA18-574,2018,143,2020,940181.0000,183710
AXNANO LLC,NMDVSFDSVCB4,Hydraulic Fracturing of Controlled Release Oxidants for Remediation of Low Permeability Zones,HHS,NIH,Phase I,SBIR,R44ES031461,1R44ES031461-01,2019-09-17,2020-08-31,PA18-574,2018,143,2019,124641.0000,176675
AXNANO LLC,NMDVSFDSVCB4,SBIR Phase II: Effective Treatment of Groundwater Pollution Using a System Utilizing Controlled Release Polymer Materials,NSF,,Phase II,SBIR,1758621,1758621,2018-03-01,2020-02-29,,2016,CT,2018,728849.0000,167587
AXNANO LLC,NMDVSFDSVCB4,Bimetallic Zero Valent Iron Composites for In Situ Remediation,DOC,NIST,Phase II,SBIR,070-05-01 (PII),70NANB17H231,2017-08-31,2019-08-30,2017-NIST-SBIR-02,2017,N/A,2017,299994.0000,162560
AXNANO LLC,NMDVSFDSVCB4,Controlled Release Polymer Structures for In Situ Chemical Oxidation of Contaminated Groundwater,HHS,NIH,Phase I,STTR,R41ES026916,1R41ES026916-01,2016-09-30,2018-03-29,PA16-414,2016,NIEHS,2016,274617.0000,158112
AXNANO LLC,NMDVSFDSVCB4,"Bimetallic Zero Valent Iron-Carbon Composites for In Situ Remediation: Improving Particle Lifetime, Reactivity and Transport",DOC,NIST,Phase I,SBIR,070.05.01 (2016),70NANB16H185,2016-08-01,2017-01-31,2016-NIST-SBIR-01,2016,9.05.01,2016,99275.0000,157218
AXNANO LLC,NMDVSFDSVCB4,STTR Phase I: Effective Treatment of Groundwater Pollution Using a System Utilizing Controlled Release Polymer Materials,NSF,,Phase I,STTR,1622866,1622866,2016-07-01,2017-06-30,,2015,CT,2016,224934.0000,157831
AXNANO LLC,NMDVSFDSVCB4,Lightweight Structures Utilizing CNFs,NASA,,Phase I,STTR,140056,NNX14CL87P,2014-06-20,2014-12-19,,2014,T10.01,2014,124905.0000,147461
