company,businessStatus,employees,description,legalName,revenue,primaryIndustrySector,hqAddressLine1,hqLocation,companyWebsite
SpreadKarma,Generating Revenue,2,"Provider of funding campaigns screening services intended to ensure its legitimacy and positive impact. The company contains vetted, trustworthy projects that add real value for the people who need it most, personally screen each campaign before allowing them on the site, ensuring people invest in funds that will have a measurable positive impact on underserved communities.","Spread Karma, LLC",,Business Products and Services (B2B),7109 Sollers Point Road,"Baltimore, MD",stage.spreadkarma.org
SpringGem Weather Information,Generating Revenue,2,"Operator of a weather forecasting platform intended to give current and forecasted weather and energy information. The company's platform integrates weather numerical forecasting, satellite and grounds remote sensing, data science, and cloud computing to provide hyperlocal weather information for urban energy, traffic safety, agriculture monitoring, and environmental assessment, enabling people and organizations to have accurate weather information as per their needs.","SpringGem Weather Information, LLC",,Consumer Products and Services (B2C),10804 Tuckahoe Way,"North Potomac, MD",sg-weather.com
Swiftink,Generating Revenue,2,"Developer of an artificial intelligence platform designed to transform audio and video content into precise text. The company's platform offers a domain-aware tool that understands specific lexicons and tasks, transcribes and translates different languages integrates with productivity tools, and processes multi-hour files.",,,Information Technology,,"Washington, DC",www.swiftink.io
Vaultuno,Startup,2,"Developer of an artificial intelligence platform designed for portfolio management. The company offers copilot guidance, real-time insights, investment education, and more, enabling retail investors to build, test, and deploy trading strategies quickly through a conversational copilot.",Vaultuno Corp.,,Information Technology,269 Singletary Lane,"Framingham, MA",www.vaultuno.com
Your Health Concierge,,2,"Operator of health and wellness coaching services. Your Health Concierge provides mental and physical wellness services, aimed at enhancing overall health and wellbeing.","Your Health Concierge, Inc.",,Consumer Products and Services (B2C),"2 Wisconsin Circle, Suite 700","Bethesda, MD",yourhealthconcierge.org
360 Dash,Generating Revenue,,"Developer of safety-monitoring devices designed to keep drivers safe during stops with law enforcement and impostors. The company's cameras feature panoramic view, wifi enabled, cloud backup, live stream connection, GPS for geo-tagging the footage, and more, thereby helping drivers capture everything from recording hit-and-run accidents to documenting encounters with the police.",360 Dash LLC,,Consumer Products and Services (B2C),672 Old Mill Road,"Millersville, MD",www.360dash.us
360VR Technology,Out of Business,,"Developer of an information platform technology designed to increase effectiveness and information visibility in all stages of emergency planning and response. The company's technology platform is specifically designed for use in day-to-day operations and in emergency response to save lives, enabling users to create an immersive media experience by using their marketing expertise, 3-D photography and drone technology.",,,Information Technology,,"Newark, DE",www.360vrtechnology.com
3D Flexible,Generating Revenue,,"Operator of a 3D printing technology company intended to offer additive technology. The company offers a variety of 3D printing services, including system integration and software or hardware development, to help users realize their designs and creations, enabling customers to benefit from expertise in materials and technology.",3DFlexible Inc,,Business Products and Services (B2B),10830 Guilford Road,"Annapolis, MD",www.3dflexible.com
Advanced Analyzer Labs,Startup,,Provider of undisclosed products and services.,"Advanced Analyzer Labs, Inc.",,Business Products and Services (B2B),3982 Old Columbia Pike,"Ellicott City, MD",
AGAPE Strategic Solutions,Generating Revenue,,"Operator of a research and technology consultancy intended for biopharmaceutical research, health systems training, and community-based engagement. The company conducts and evaluates evidence with a focus on diverse perspectives and strategies aimed at eliminating disparities in health outcomes using both in-person and AI web-based applications, enabling its users to be informed and engaged in medical research that addresses gaps in care, health equity, and costs within the healthcare and social ecosystem.","AGAPE Strategic Solutions of Maryland, LLC",,Healthcare,3102 Tribune Court,"Hyattsville, MD",www.agapessom.com
American Biosystems,Generating Revenue,,"Developer of microbial and enzyme-based products intended for for agriculture, animal industry, and enzyme markets. The company offers products that aid in animal feed, aquaculture, and municipal wastewater treatment by utilizing environmentally friendly bacteria and enzymes, enabling industries and markets to address their needs with enzymes and ingredients while remaining environmentally responsible.",American Biosystems Inc.,,Materials and Resources,P.O. Box 1523,"Roanoke, VA",www.americanbiosystems.com
Assure Medical Technologies,Generating Revenue,,"Operator of a healthcare device and equipment company intended to keep patients safe and healthy. The company offers a precise device that assists healthcare professionals in measuring the correct amount of medicine with a syringe, enabling healthcare professionals to improve patients' safety in hospitals.",Assure Technologies LLC,,Healthcare,200 Butternut Drive,"Chapel Hill, NC",www.nuvai.ai
Bashpole Software,Generating Revenue,,"Owner and operator of a software development company intended to design software suite for facilitating breach prevetntion and maintaining data privacy. The company's software products mainly focus on applied research and development on many advanced computer science topics including without limitation deep learning, Information fusion, big data analytics, intelligence, surveillance and reconnaissance exploitation, imagery and visualization, optical character recognition and language technology, enabling local, state and federal governments, the US Military, for-profit businesses and nonprofit clients to detect and eliminate data security risks.","Bashpole Software, Inc.",,Information Technology,8791 East Wesley Lane,"North Webster, IN",www.bashpolesoftware.com
BioBind,Startup,,"Operator of a biotechnology company intended to mitigate the effects of toxic metal exposure in the human body. The company is developing a chelation therapy that can bind to and sequester various toxic metals, such as lead, mercury, cadmium and arsenic, enabling healthcare professionals to help reduce the concentration in the patient's body and mitigate the harmful effects.",BioBind Inc.,,Healthcare,4620 Henry Street,"Pittsburgh, PA",
Biokmir,Startup,,"Developer of point-of-care diagnostic tool intended to detect multi-drug resistant tuberculosis (MDR-TB) infection. The company is designing a molecular diagnostic device that uses nucleic acid amplification technology to detect MDR-TB in a matter of hours, enabling healthcare providers in developing countries to diagnose MDR-TB more quickly and accurately.",Biokmir Africa LLC,,Healthcare,"5, Rue Rouget De L'isle, 6th floor","Casablanca, Morocco",www.biokmir.com
Bolston Technology,Startup,,"Developer of wildfire protection products designed to mitigate the threats of wildfires. The company's products improve the growing problem of wildfires, which are becoming more frequent and destructive due to climate change, topography, and poor fire management strategies, enabling citizens and professionals with peace of mind and survival options for people living in high-risk areas.","Bolston, LLC",,Business Products and Services (B2B),1519 York Road,"Lutherville Timonium, MD",www.bolston.net
Brayearst Validation Consulting,,,"Brayearst Validation Consulting is a validation consulting company that specializes in FDA compliance and process optimization using Six Sigma. Their services include installation qualification, operation and performance qualification, process performance qualification, cleaning validation, software validation or computer system validation, test method validation or analytical method validation, validation master plan, validation training, and Six Sigma training. The company has over 30 years of experience in the chemical and medical device manufacturing industries and operates under NAICS codes 541690 and 611430.",,,Business Products and Services (B2B),"1777 Reisterstown Rd, W-22 PMB 221","Pikesville, MD",brayearst.com
BTU Insight,Startup,,"Developer of solar products intended to eliminate or reduce monthly energy expenses. The company's products are eco-friendly heating products for tiny homes and trailer homes and are designed to support outdoor living, beaches and disaster recovery efforts where sanitization systems are nonfunctioning, enabling users to improve the environment and the community using solar technology and also save money.",BTU Insight LLC,,Consumer Products and Services (B2C),2119 Robert Bowie Drive,"Upper Marlboro, MD",www.btuinsightllc.com
CA Enterprise (Other Commercial Products),Generating Revenue,,"Provider of undisclosed products and services headquartered in Suitland, Maryland.",CA Enterprise LLC,,Business Products and Services (B2B),2220 Lakewood Street,"Suitland, MD",www.caenterprise.net
Capital eXperience Group,,,"Operator of change management and technology adoption services for businesses. Capital eXperience Group provides project rescue, technology adoption and change management, and leadership coaching services. The entity caters to diverse industries.",,,Information Technology,,"Washington, DC",capitalexperiencegroup.com
Carecompanion,Generating Revenue,,"Developer of a medical network directory platform designed to automatically generate personalized care plans and eliminate time-consuming processes of manual retrieval and transfer between healthcare providers. The company's platform manages and suggests care plan recommendations derived from comprehensive EMR data, lifestyle data, social determinants of health, and research-backed clinical interventions, thereby enabling physicians and health managers to access critical patient information and integrate with the existing healthcare system and granting instant access to various medical records, whiling reduce delays.","Carecompanion, Inc.",,Healthcare,,"Washington, DC",ourcarecompanion.com
CeleFlux,Pre-Clinical Trials,,"Developer of urological medical device designed to reconstruct the urethra in order to restore urine flow in the human body. The company's device bridges the gap between current minimally invasive management options and open surgical reconstruction, enabling patients to restore their quality of life through easy treatment of urology.",CeleFlux LLC,,Healthcare,463 Severnside Drive,"Severna Park, MD",www.celeflux.com
ClearAlignment,,,"The company primarily operates in the Educational and Training Services (B2C) industry. ClearAlignment was founded in 2017 and is headquartered in Towson, MD.",,,Consumer Products and Services (B2C),7400 York Rd,"Towson, MD",clearalignment.org
Clearview360,Out of Business,,"Developer of organizational assessment tools designed for the needs of the rapidly changing healthcare environment. The company's tools incorporate cultural competency with patient satisfaction and experience assessments as well as provide consulting that improves clinical, operational, financial, and experiential outcomes, enabling healthcare organizations with an integrated view of performance.","Clearview Organizational Assessments, LLC",,Healthcare,7702 Plum Street,"New Orleans, LA",www.clearview360.org
Corduroy Diagnostics,Out of Business,,Developer of diagnostics products designed for medical industry.,Corduroy Diagnostics LLC,,Healthcare,1001 Rockville Pike,"Rockville, MD",www.cordoroydx.com
Cranenano,Generating Revenue,,"Provider of consultancy services intended to offer high-quality consultancy services and platform technology in different customer segments. The company's service provides management, scientific and technical consultancy, research, development, and test of anti-fouling and corrosion coating formulations, development of prototypes, licenses, patents, pilot and commercial scale nanocomposite coatings manufacture, enabling companies to get coating formulations with benefits of shorter curing time and longer lifespan.",Cranenano LLC,,Business Products and Services (B2B),31 Orchard Drive,"Gaithersburg, MD",www.cranenano.com
Creative Genius Works,Generating Revenue,,"Operator of a creative media company intended for innovation, influence, and imagination, with integrity. The company helps their clients magnify their visions into products and services that make a positive impact on the world, enabling individuals and organizations to achieve their full potential through creativity, innovation, and entrepreneurship.","Creative Genius Works, LLC",,Consumer Products and Services (B2C),410 East 22nd Street,"Baltimore, MD",www.creativegeniusworks.com
Cusack Prep,,,"Operator of a tutoring service geared towards academic success and college preparation. Cusack Prep provides expert tutors for math, science, humanities, standardized test prep, and more. Tutors personalize their approach to each student's learning style and offer tailored support.",Cusack Prep LLC,,Information Technology,5141 Dudley Ln,"Bethesda, MD",cusackprep.com
Cyberstanc,Generating Revenue,,"Provider of cybersecurity services intended to protect businesses from sophisticated cyber threats. The company leverages artificial intelligence to provide comprehensive cybersecurity solutions through enhanced protection against evolving threats, proactive security, improved security posture and improved preparedness, enabling customers to protect their data, systems, and networks from evolving cyber threats.",Cyberstanc Corp.,,Business Products and Services (B2B),8 The Green STER,"Dover, DE",www.cyberstanc.com
Cykloburn Technologies,Out of Business,,"Developer of low-emission combustion technology designed to commercialize an innovative poultry waste-to-energy technology. The company's technology uses a fluidized bed combustion system to overcome the disadvantages of existing biomass-to-energy services, which represents a significant value proposition to individual poultry farmers, by ridding them of waste, enabling users to manage environmentally damaging pollution from excess poultry farm litter and generating energy from renewable resources.","Cykloburn Technologies, LLC",,Energy,1200 Shore Road,"Baltimore, MD",www.cykloburn.com
Digii Digital,Generating Revenue,,"Developer of wearable digital displays designed for graduation ceremonies. The company's product is a lightweight, high-resolution display that graduates can customize with photos or text using a mobile app, allowing graduates to showcase their memories and messages in a novel way, enhancing their graduation experience.",Digii Digital LLC,,Information Technology,131 Swiss Gap Road,"Upper Marlboro, MD",www.digiidigital.com
Early Charm Ventures,Generating Revenue,,"Operator of venture studio firm intended to help convert science to business. The company specializes in the scientific discoveries made at universities and turning them into companies focused on growth that create sustainable value as well as actively manage and maintain governance control over portfolio companies in the initial years of operations, enabling clients to actively self-manage industries.","Early Charm Ventures, LLC",,Financial Services,1300 Bayard Street,"Baltimore, MD",www.earlycharm.com
Edessa,Generating Revenue,,"Edessa is a Fontana, CA based private company whose line of business is Mfg concrete products","Edessa, Inc.",,Materials and Resources,11027 Cherry Ave,"Fontana, CA",
Epigenos Biosciences,Generating Revenue,,Developer of drug therapy. The company develops personalized epigenome-based therapeutics that leverage Cas9 technology to treat diseases at the root of gene misregulation.,Epigenos Biosciences Inc.,,Healthcare,5151 McCrimmon Parkway,"Morrisville, NC",www.epigenos.com
Flexadyne,Out of Business,,"Developer of medical braces designed for patients recovering from ACL injuries. The company's braces use 3D printing technology, and CAD design software and consult directly with healthcare providers to ensure a perfect fit and custom printed for each patient, enabling customers to get a comfortable and durable brace at affordable rates.","Flexadyne, Inc.",,Healthcare,1001 Emmet Street North,"Charlottesville, VA",www.flexadyne.co
FullBlast STEAM,Generating Revenue,,"Developer of online educational software designed to bridge the digital divide by engaging youth. The company's software offers virtual guidance and online workshops in robotics, drones, 3D printing, artificial intelligence, and virtual reality technologies, enabling students to advance in their careers.",PELICAN FLY LLC,,Information Technology,1100 Wicomico Street,"Baltimore, MD",www.fullblaststeam.com
Future State Health Information Management Systems,Generating Revenue,,"Provider of undisclosed products and services headquartered in Gaithersburg, Maryland.",Future State Health Information Management Systems LLC,,Business Products and Services (B2B),214 Ellington Boulevard,"Gaithersburg, MD",
G4 Bikes,Generating Revenue,,"Manufacturer of recumbent bicycles intended to offer a high-performance machine that effectively integrates and engages the rider for a uniquely satisfying riding experience. The company's bicycles specialize in foot pedal crankset mounted, seated rider who use their full body to pedal and apply supplemental, and aerodynamic disk wheels, thereby enabling customers an easy to ride, accelerates, and climb like upright bikes, with speed, comfort, and safety.","Generation Four Bicycle System Engineering, LLC",,Consumer Products and Services (B2C),2507 Palmer View Drive,"Bel Air, MD",www.g4bikes.com
GlowGadget,Startup,,"Operator of a smart lighting company intended to build flexible lighting technology. The company offers smart lighting apparel potentially illuminating spaces in new and innovative ways, enabling customers to get wearable light-up devices that can be controlled by their phone.","GLOWGADGET, LLC",,Consumer Products and Services (B2C),,WA,www.glowgadget.com
GlycoT Therapeutics,Generating Revenue,,"Developer of chemoenzymatic glycosylation technology created to provide structurally well-defined, homogeneous glycoforms with unique properties. The company's technology for glycoengineering of therapeutic proteins such as monoclonal antibodies also produces enzymes, oligosaccharides, glycopeptides and other glycoprotein products as valuable research tools for disease diagnosis and the glycobiology research field, enabling clients to improve their therapeutic efficacy.",GlycoT Therapeutics LLC,,Healthcare,4991 Wild Olive CT,"College Park, MD",www.glycot.com
Graybeard Coaching,,,"Consulting firm specializing in policy, acquisition, and engineering solutions for complex problems in dynamic environments. Offers operating advice and assistance on strategic and organizational planning, business process improvement, asset management, and records management. Provides professional consulting services in engineering and scientific research and development to create new or improved products and processes.",,,Business Products and Services (B2B),10328 Mockingbird Pond Ct,"Burke, VA",grayzonesolutions.com
GUAQ,Generating Revenue,,"Manufacturer of air quality monitors intended to offer a low-cost environmental monitoring ecosystem. The company offers a hardware device, mobile application, and curated analytics to measure an array of environmental hazards, enabling individuals and enterprises to gain a better understanding of the air they breathe.",,,Information Technology,,WA,www.guaq.tech
Halo Scientific,Startup,,"Developer of surgical tracking technologies based in Towson, Maryland. The company develops products to improve efficiency and communication in hospital operating rooms, enabling surgeons to conduct surgeries safely and efficiently.",Halo Scientific LLC,,Healthcare,8686 Manahan Drive,"Towson, MD",
Healthier Forms,Startup,,"Developer of pre-screening software designed to proactively address patient safety during (magnetic resonance imaging)MRI scans. The company's platform utilizes advanced algorithms to analyze screening information and identify potential hazards from implants or metal objects, enabling imaging centers to receive real-time notifications and manage their MRI schedules accordingly, ultimately reducing scheduling disruptions and improving patient experience.","Healthier Forms, Inc.",,Healthcare,Kent,"Dover, DE",www.healthierforms.com
Hyve (Media and Information Services),Out of Business,,"Developer of an artificial intelligence-driven fleet management platform designed to streamline vehicle maintenance and insurance. The company's platform tracks every detail of fleets and provides safety management techniques eliminating vehicle management hassles for fleets across the globe, enabling clients to take control of routine maintenance, and emergency repairs and ensure safety and compliance.",,,Information Technology,11 East Loop Road,"New York, NY",www.hyve.ai
InceptEV,Generating Revenue,,"Operator of an electric vehicle data company intended for fleet operations planning and optimization. The company's platform uses proprietary data and patented technology to understand fleet performance before purchasing assets and forecast operational requirements, enabling businesses to confidently navigate the electric revolution and achieve their fleet electrification goals.","Incepts, Inc.",,Information Technology,PO Box 81752,"Pittsburgh, PA",www.inceptev.com
ItinAFairy,Generating Revenue,,"Operator of a travel planning company headquartered in Baltimore, Maryland. The company specializes in creating unique itineraries to make clients' travel experiences easy, enjoyable, and tailored to their travel personality.","ItinAFairy, LLC.",,Consumer Products and Services (B2C),822 Guilford Avenue,"Baltimore, MD",www.itinafairy.com
itutela,Out of Business,,"Developer and provider of scalable internet, security and monitoring solutions designed for the healthcare industry. The company offers unified software platforms, data analytics and cloud-based distributed systems, enabling hospitals to improve patient engagement and access while enhancing hospital's network security.","itutela, LLC",,Healthcare,101 North Haven Street,"Baltimore, MD",www.itutela.com
Jay's Watermelonade,Generating Revenue,,"Producer of fruit blends intended to hydrate the community while promoting nutritional wellness. The company offers natural juices and frozen treats made from raw fruits, vegetables, and herbs, helping customers by lowering rates of diabetes, obesity, and heart disease through nutrition education.","Jay's Watermelonade, LLC",,Consumer Products and Services (B2C),4709 Harford Road 14,"Baltimore, MD",www.jayswatermelonade.com
Kaalmi,Out of Business,,"Provider of curated mental health care packages intended to make users stress-free. The company offers a variety of products including creative engagement activities, mindfulness exercises and sensory grounding tools, enabling customers to manage their mental health through self-care practices.",Kaalmi LLC,,Consumer Products and Services (B2C),3203 Grindle Court,"Abingdon, MD",www.kaalmi.com
Karaman Language Solutions,Generating Revenue,,"Provider of foreign language services to various markets. Karaman Language Solutions offers language training, translation, interpreting, localization, and eLearning design. Their services include in-person and online language training, proficiency testing, document translation, audio/video translation, on-site, phone, video simultaneous, and consecutive interpreting. They serve international law firms, corporations, organizations, non-profits, and local, state, and federal United States government agencies. Additionally, they offer online language and culture courses and customized private or small group classes on a full-time and part-time basis via live virtual, in-person, and hybrid classrooms.",,,Information Technology,,"Alexandria, VA",karamandc.com
kloudtrack,Startup,,"Developer of a platform designed to address international, federal, state and industry-imposed regulatory compliance standards. The company's platform offers governance, risk and compliance technologies and solutions for business processes, data management, and human interaction workflow and integrates best-practice management with audit trails that place a premium on monitoring users, data, transparency, and collaborative processes, enabling clients to address regulatory compliance standards issues effectively.",,,Information Technology,6010 Executive Boulevard,"Rockville, MD",www.kloudtrack.com
Knope,Generating Revenue,,"Developer of a drink spiking prevention platform intended to offer products to detect the presence of rape-drug in any drink. The company's platform offers napkins and drink covers to facilitate easy testing for rape drugs by placing a few drops of the drink on a designated part of the napkin or the cover, enabling users to be safe and avoid being drugged.","KnoNap, LLC.",,Consumer Products and Services (B2C),3400 Prospect Street North West,"Washington, DC",www.knonap.com
