company,businessStatus,employees,description,legalName,revenue,primaryIndustrySector,hqAddressLine1,hqLocation,companyWebsite
Datasembly,Generating Revenue,72,"Developer of a data analytics platform designed to offer real-time data to make real-life decisions. The company offers a data-as-a-service model by leveraging natural language processing and machine learning techniques to transform disparate data into organized information, enabling clients to get in-store and real-time, pricing, promotions, and availability data, without stepping foot in a store.","Datasembly, Inc.",,Information Technology,1775 Tysons Boulevard,"Tysons, VA",www.datasembly.com
Ion Storage Systems,Generating Revenue,71,"Developer of solid-state batteries intended to select cathode materials based on application. The company's batteries are designed as two sponges on either side of a thin ceramic separator, made from low-cost materials that are completely non-flammable and are safe, light, and small for consumer electronics and electric vehicles, enabling defense and aerospace industries to meet mission-critical energy dense and safe batteries that can be deployed in any environment.","Ion Storage Systems, LLC",,Business Products and Services (B2B),12500 Baltimore Avenue,"Beltsville, MD",www.ionstoragesystems.com
Loop (Automotive Insurance),Generating Revenue,52,"Provider of auto insurance services intended to leverage artificial intelligence, big data, and telematics to create more fairly priced insurance products. The company's service provides an artificial intelligence-based approach to pricing measures road safety and its customers' driving behavior on those roads, enabling customers to get quoted instantly, insured within minutes, and receive good customer service.","Loop Mobility, Inc.",,Financial Services,208 Lessin Lane,"Austin, TX",www.ridewithloop.com
Esurgi,Generating Revenue,40,"Operator of a biotech company intended to deliver real-time healthcare to improve lives and the relationship between healthcare providers and their patients. The company specializes in hardware, software, medical devices, injury prevention, ACL, low back pain, physical therapy, and Alzheimer's.","Esurgi, Inc.",,Healthcare,109 Belfast Road,"Lutherville-Timonium, MD",www.myesurgi.com
TDAY Sports,,39,"Operator of a sports media network consisting of 6 brands. Provides daily sports news, highlights, and stories on YouTube, Instagram, and TikTok. Offers brand partnerships.",,,Consumer Products and Services (B2C),,"State College, PA",tdaysports.com
Ashvattha Therapeutics,Clinical Trials - Phase 2,35,"Developer of hydroxyl dendrimer therapeutics designed to meet the unmet medical needs in oncology, ophthalmology and inflammatory diseases. The company's therapeutics selectively target actively endocytosing cells such as reactive microglia and macrophages responsible for chronic inflammation and disease progression within the body, enabling medical practitioners to treat patients with improved efficacy and reduced side effects.","Ashvattha Therapeutics, Inc.",,Healthcare,1235 Radio Road,"Redwood City, CA",www.avttx.com
N5 Sensors,Generating Revenue,35,"Developer of chemical sensor technology intended to keep people safe from environmental hazards through a cloud-connected ecosystem of smarter sensors. The company's technology develops sensors that are built using the same fabrication processes that are commonly used for silicon computer chips and are small and accurate with the capability to detect multiple gases at the same time, enabling industrial workers, first responders, and soldiers to assess the dangers of their surroundings rapidly and accurately in real-time using their smartphones.","N5 Sensors, Inc.",,Information Technology,9605 Medical Center Drive,"Rockville, MD",www.n5sensors.com
Armaments Research Company,Generating Revenue,34,"Developer of a self-aware system designed to protect the lives of national security, public safety, and private security personnel. The company's system consists of a series of small, ruggedized Artificial intelligence-powered sensors built into the grips of a firearm that monitor utilization at the edge and provide analytics and insights using instant notification, enabling clients to save lives and protect people.","Armaments Research Company, Inc.",8.30,Information Technology,5231 57th Avenue South,"Seattle, WA",www.armaments.us
SinnovaTek,Generating Revenue,34,"Developer of food processing technologies designed to promote worldwide health and wellness through sustainable methods. The company provides continuous flow microwave processing systems for ingredient sourcing, product development, and processing, as well as end packaging along with engineering, research, and development assistance, enabling consumer packaged goods brands to launch and test new products in an aseptic format and deliver healthy food.","SinnovaTek, Inc.",0.38,Business Products and Services (B2B),2609 Discovery Drive,"Raleigh, NC",www.sinnovatek.com
DeepMirror (Business/Productivity Software),Generating Revenue,30,"Developer of spatial intelligent technology. The company's spatial intelligence technology integrates 5G technology, artificial intelligence and augmented reality technologies and can be applied in various industries, such as commercial space, entertainment and transportation industry.","Guangzhou DeepMirror Technology Co., Ltd.",,Information Technology,Room 503-506,"Guangzhou, China",www.deepmirror.com
Quidient,Profitable,30,"Developer of 3D imagers, omnidirectional light fields, and a spatial processing system designed to deliver intrinsic imaging. The company's engines capture photorealistic 3D models of any scene or object on Earth for Generalized Scene Reconstruction (GSR) in a five-dimensional (5D) setting, enabling users to use devices like smartphones to create complete, visually accurate models of any scene or object, including those that are shiny and transparent.","Quidient, LLC",,Information Technology,7142 Columbia Gateway Drive,"Columbia, MD",www.quidient.com
READY Robotics,Generating Revenue,27,"Developer of an enterprise-grade automation interface designed to improve the quality of life and productivity through automation. The company's platform connects robotic devices equipped with a cloud computing unit which helps operators control and program common brands of robots from a single interface with minimal training, enabling manufacturers to solve their labour challenges, boost output, improve quality, reduce costs, and augment their workforce through automation.",READY Robotics Corporation,0.52,Information Technology,1080 Steelwood Road,"Columbus, OH",ready-robotics.com
Blue Rose Consulting Group,Generating Revenue,26,"Provider of consulting services to global commercial and public sector organizations. The company's services include management, people advisory, IT solutions and many other services, enabling the clients to avail the desired services.","Blue Rose Consulting Group, Inc",,Business Products and Services (B2B),2200 Pennsylvania Avenue North West,"Washington, DC",www.bluerose-consulting.com
BEIT,Generating Revenue,24,"Developer of quantum computer algorithms designed to solve an NP-complete class of problems. The company focuses on the Hamiltonian cycle problem to solve hard problems that are not solvable through classical machines, enabling companies in the logistics, manufacturing, and warehousing sectors to effectively implement algorithms.",BEIT Inc.,15.13,Information Technology,Mogilska 43,"Krakow, Poland",www.beit.tech
Sonavex,Clinical Trials - Phase 4,24,"Developer of a bioresorbable and echogenic equipment technology designed to mark at-risk blood vessels. The company's technology collects arteriovenous fistula volumetric flow rate, diameter, and depth information at the dialysis clinic to support maturation assessment such that the site can be easily assessed for future complications, enabling healthcare providers to determine blood flow and morphology of vessels and get actionable data to deliver patient care.","Sonavex, Inc.",,Healthcare,2835 O'Donnell Street,"Baltimore, MD",www.sonavex.com
CoapTech,Generating Revenue,22,"Developer of invasive surgical devices designed to offer point-of-care ultrasound procedures in hollow organs. The company's devices provide a novel platform technology that combines magnetic attraction for device placement guidance and low-cost point-of-care ultrasound for visual feedback in diagnostic, and interventional, enabling medical professionals to deskill the procedure for feeding tube placement, offering a simple, safe, and affordable method.","CoapTech, Inc.",,Healthcare,101 West Dickman Street,"Baltimore, MD",www.coaptech.com
PayAnalytics,Generating Revenue,21,"Developer of compensation analytics software designed to monitor and address gender pay gaps in corporations. The company's software provides payroll analysis tools to measure and subsequently close the pay range, enabling clients to close the demographic pay gaps and monitor salary data over time to ensure the gaps remain closed.",PayAnalytics ehf.,,Information Technology,Gróska Bjargargata 1,"Reykjavik, Iceland",www.payanalytics.com
PerSoN Clinic,Generating Revenue,21,"Operator of an eHealth technology platform intended to offer comprehensive virtual care. The company offers a turn-key, Software-as-a-service model-based platform for health systems and researchers along with online counselling services, enabling patients, caregivers, care providers teams and researchers to connect with Bi-Directional data flow for better outcomes.",PerSoN Clinic LLC,,Healthcare,12430 Park Potomac Avenue,"Potomac, MD",www.person.clinic
PediaMetrix,Generating Revenue,20,"Developer of a mobile application designed for infants' cranial measurement and monitoring at the point of care. The company's application uses computer vision and artificial intelligence algorithms to keep a record of a baby's head growth pattern, get instant quantitative head shape analysis, personalized instructions, and referral to the right professionals if the need arises, enabling parents and pediatric providers to prevent head malformations and take proper care of their children.",PediaMetrix Inc.,0.10,Healthcare,155 Gibbs Street,"Rockville, MD",www.pediametrix.com
techcos,,20,"Techcos GmbH is a Munich-based company that provides functional safety services. They specialize in consulting on systems security, functional safety, and information security. Their services are designed to support development teams in all aspects of security.",techcos GmbH,,Consumer Products and Services (B2C),Leopoldstraße 256,"Munich, Germany",techcos.de
Vitalize Care,Generating Revenue,20,"Developer of social network and wellness platform designed to improve mental and emotional well-being. The company's platform facilitates cognitive behavioral therapy to provide real-time data on staff well-being/performance and offers access to evidence-based digital mental health, enabling employers to understand and support their staff through a dashboard with data on staff mental health trends, app engagement, and drivers of burnout.","Vitalize Care, Inc.",,Healthcare,650 California Street,"San Francisco, CA",www.vitalize.care
Impruvon Health,Generating Revenue,19,"Developer of a medical technology platform designed for automated medication management. The company's platform offers smart alerts, reminders, live alerts of unauthorized access attempts, and notifications customized to each individual's needs, enabling healthcare providers to prevent medications from winding up in the wrong hands.","Impruvon, Inc",0.40,Healthcare,2101 East Biddle Street,"Baltimore, MD",www.impruvonhealth.com
HSR.health,Generating Revenue,18,"Developer of healthcare technology designed to build an innovative and unique health-focused spatial data infrastructure. The company develops cloud-based analytics and visualization platform that merges data on social determinants of health with social media data, health outcomes, and costs to extract clinical insights, thereby helping healthcare organizations to transform and commercialize the ground-breaking research into innovative, actionable solutions saving costs and lives while bringing health risk insights to the industry.","Health Solutions Research, Inc.",,Healthcare,Storey Avenue,"San Francisco, CA",www.hsr.health
InventWood,Clinical Trials - General,18,"Developer of wood-based materials designed to improve thermal energy. The company creates wood materials that are high-performance, cost-effective, and environmentally sustainable and provide energy efficiency, sunlight guiding, lighter wood for safety and installation, and anti-shatter, enabling the organization to provide natural goods while building a more sustainable future for generations to come that results in carbon-negative construction.",InventWood LLC,,Materials and Resources,5971 Jefferson Station Court,"Frederick, MD",www.inventwood.com
NextStep Robotics,Generating Revenue,18,"Developer of a portable ankle rehabilitation device designed to assist individuals with foot drop during physical therapy. The company's platform integrates advanced robotics and intelligent algorithms, offering real-time feedback and graded assistance to enhance mobility outcomes, enabling healthcare professionals to improve patient rehabilitation efficiency while reducing reliance on traditional assistive devices.","NextStep Robotics, Inc.",1.50,Healthcare,800 West Baltimore Street,"Baltimore, MD",www.nextsteprobo.com
Healable,Generating Revenue,17,"Developer of a mental health application designed for health care professionals to communicate with patients. The company's platform includes engaging content, community-based support, and including user categories such as patients, healthcare professionals, and social media influencers.",Healable Inc.,,Healthcare,55 Gibbs Street,"Rockville, MD",www.healable.com
Hazel Analytics,Generating Revenue,16,"Developer of a database software designed to deliver information on food safety. The company's platform specializes in real-time collects inspections from health department jurisdictions, enabling chain food retail operators to protect their brands and manage their compliance.",Hazel Analytics Inc.,,Information Technology,600 Stewart Street,"Seattle, WA",www.hazelanalytics.com
Advanced Aircraft Company,Generating Revenue,14,"Operator of the long-endurance tilt-wing uncrewed aircraft system designed for military and defense applications. The company's aircraft is designed for long-endurance operations and can carry multiple sensor and cargo payloads using its Utilizing Distributed Electric Propulsion (DEP) systems and aerodynamic airframes, and operates in the most austere land and maritime conditions with no operational infrastructure required, enabling clients to improve mission performance and reduce their cost per acre.",Advanced Aircraft LLC,,Information Technology,1100 Exploration Way,"Hampton, VA",advancedaircraftcompany.com
Datalytica,,14,"Operator of consulting and software solutions for national security. Datalytica offers science and technology guidance to enhance national security, specializing in computational sciences and cybersecurity. The entity provides leadership in major acquisition portfolios, research and development, and training on emerging technologies.",,,Information Technology,,"Laurel, MD",datalytica.net
Nexus 8 International,Generating Revenue,14,"Developer of a health tech platform designed to facilitate knowledge-sharing among healthcare providers. The company specializes in technology that immediate access to other experts and, expedient, collaborative tool that elicits efficient, value-laden consultation among healthcare professionals, thereby helping customers to maximize healthcare outcomes, particularly in the face of healthcare crises, such as the covid pandemic, and chronically challenging or treatment-resistant cases.","Nexus 8 International, LLC",,Healthcare,"5028 Wisconsin Avenue, Northwest","Washington, DC",www.nexus8international.com
RedShred,Generating Revenue,14,"Developer of open-information extraction software designed to provide immediate answers to various data analysis reports. The company's software automatically searches, analyzes, and extracts decision-making criteria from thousands of publicly available requests for proposals and grants each day, enabling government contractors, institutions, and universities to search, pre-qualify, track, and extract relevant information from publically available requests for proposals and grant documents to review opportunities with minimal manual intervention.",RedShred LLC,,Information Technology,5520 Research Park Drive,"Baltimore, MD",www.redshred.com
TotalCare,Generating Revenue,14,"Developer of chronic care management software intended to make healthcare more accessible. The company's software is an intuitive telemedicine platform that provides virtually scheduled visits to the patient's current healthcare and helps patients to self-manage their chronic diseases like diabetes, obesity, hypertension, COPD, cardiovascular diseases, neurological disorders, cancer, and others from the place of their convenience, enabling physicians, specialists, and behavioral health specialists to connect with their patients virtually and reduce health inequity.","Hawkeye Med Tech, Inc.",,Healthcare,6751 Columbia Gateway Drive,"Columbia, MD",www.hawkeyemedtech.com
getGFTD,Generating Revenue,13,"Developer of a digital gift card platform intended to replace physical gift cards. The company's platform allows one to send digital cards to friends and family, with no fees or expiration dates and makes it a convenient and environmentally friendly alternative to traditional present cards, digital Wishlist's, and giving apps that streamline sending and receiving gifts, enabling users easy to use affordable, and sustainable cards.","etGFTD, LLC",,Financial Services,7101 Rich Hill Road,"Baltimore, MD",www.getgftdapp.com
Oculi,Generating Revenue,13,"Developer of 3D image sensors designed for machine vision applications. The company offers data security and privacy-protected sources and true edge processors on a single chip to deliver performance, low latency decisions about defects, anomaly detection, preventative maintenance, and safety, enabling industrials, retail, and other related industries to have a sensor product at affordable prices.","Oculi, Inc.",,Information Technology,260 East Main Street,"Rochester, NY",www.oculi.ai
Accelevir,Generating Revenue,12,"Developer of infectious disease assays with a core expertise for quantitation of low-frequency viral targets intended to detect inactive human immunodeficiency viruses in the blood. The company's technology uses a medical device and diagnostic tool to accurately measure the size of the latent reservoir by quantifying the number of intact viruses, enabling physicians to substantially improve the length and quality of life of critically ill patients in areas of major unmet medical and reservoir measurements for the advancement of HIV-1 cure trials.","Accelevir Diagnostics, LLC",,Healthcare,701 East Pratt Street,"Baltimore, MD",www.accelevirdx.com
MindStand,Generating Revenue,12,"Developer of an online harassment detection platform designed to protect friends, co-workers, and students. The company's platform identifies online harassment, hate speech, suicidality, low engagement, and other troubling behaviours within an organization's internal communications using artificial intelligence, enabling businesses to provide personalized insights on workplace security and inclusions.",MindStand Technologies Inc.,,Information Technology,5520 Research Park Drive,"Catonsville, MD",www.mindstand.com
miRecule,Generating Revenue,12,"Operator of a micro RNA-based therapeutics platform intended to treat cancer and muscular dystrophy. The company's platform integrates genomic sequencing, expression, and prognostic data from hundreds of cancer patients with high throughput screening data of microRNA to identify its candidates for miR replacement therapy and formulates it into tumor-targeted nanoparticles, enabling oncologists to identify microRNA targets and eradicate drug-resistant cancer cells from the body.","miRecule, Inc.",,Healthcare,704 Quince Orchard Road,"Gaithersburg, MD",www.mirecule.com
Silvec Biologics,Generating Revenue,12,"Developer of RNA therapies designed to inoculate trees, vines, and bushes against diseases, eliminating the need for genetic modification. The company's RNA therapy includes introducing a virus like RNA bacterial inside the tree veins to destroy viral and fungal pathogens, enabling food growers to ensure abundant and diverse food supplies while protecting natural resources.",Silvec Biologics Inc.,,Materials and Resources,200 Girard Street,"Gaithersburg, MD",www.silvec.com
X-Wave Innovations,Generating Revenue,12,"Operator of a research and development firm intended to provide innovative alternatives and products for federal and commercial customers in defense, homeland security, transportation and energy. The company conducts both cutting-edge R&D and technology transitioning, enabling customers to get effective results.","X-Wave Innovations, Inc.",,Business Products and Services (B2B),555 Quince Orchard Road,"Gaithersburg, MD",www.x-waveinnovations.com
Airgility,Generating Revenue,11,"Designer and manufacturer of unmanned aerial systems designed to fly anywhere. The company's products are artificially intelligent drones that can fly to confined areas where there is limited or no global positioning system access, enabling clients to get information in real-time and improving decision-making in the critical moments of a disaster or for any type of inspection/assessment.","Airgility, Inc.",0.17,Information Technology,5016 Lehigh Road,"College Park, MD",www.airgility.co
Gibbs Marketing,,11,"Gibbs Marketing is a provider of marketing solutions and services for businesses. Their services include call center outsourcing, telemarketing campaigns, lead generation, appointment setting, customer service, social media marketing, email and event marketing, as well as printing services. The company has been operating for over 10 years and values work-life balance for their employees, offering career opportunities in the marketing industry.",Gibbs Marketing LLC,,Business Products and Services (B2B),408 Headquarters Dr,"Millersville, MD",gibbsmarketingllc.com
Glycan Therapeutics,Generating Revenue,11,"Developer of innovative carbohydrate medicines and solutions intended to synthesize heparin and heparan sulfate oligosaccharides for medical uses. The company develops drug therapies based on a novel synthetic carbohydrate technology platform to synthesize an anticoagulant drug like synthetic heparin and design heparin-like oligosaccharides for research and development for other medical applications and also develops enzymatically synthesized sulfated oligosaccharides for a variety of indications, thereby offering researchers a range of heparan sulfates and chondroitin sulfates to utilize for their next big endeavor.","Glycan Therapeutics, LLC",,Healthcare,617 Hutton Street,"Raleigh, NC",www.glycantherapeutics.com
Pay Your Tuition,Generating Revenue,11,"Provider of financial services intended to help foster economic and educational equality opportunities. The company's platform connects families with banks to offer lower rates to finance higher education by using a shared economy method as well as offers multiple student-centric financial products to match financial needs with the right money, enabling college students to fund their college tuition and education costs.","PYT Funds, Inc.",0.01,Financial Services,712 H Street North East,"Washington, DC",www.gopyt.com
VisiSonics,Generating Revenue,11,"Developer of three-dimensional spatial audio technologies designed to enhance end-user performance and overall experience. The company's physics-based RealSpace 3-Dimensional audio technology is licensed by consumer electronics brands, semiconductor manufacturers, and game developers, and its head-related transfer function personalization and in-device audiogram measurement allow personalization to the end user where it captures and analysis tech enable sound stages, enabling auto manufacturers, leading research institutions, and the military acoustic measurement and visualization solutions for NVH (Noise, Vibration, and Harshness) and industrial noise detection.",VisiSonics Corporation,1.00,Information Technology,5600 Rivertech Court,"Riverdale Park, MD",visisonics.com
Camelia,Generating Revenue,10,"Camelia is a Leonardtown, MD based private company whose line of business is Whol lumber/plywood/millwork",Camelia Inc.,2.31,Business Products and Services (B2B),39650 Big Chestnut Rd,"Leonardtown, MD",camelia-international.com
FileMap,,10,"The company primarily operates in the IT Consulting and Outsourcing industry. FileMap was founded in 2019 and is headquartered in San Francisco, CA.",,,Information Technology,,"San Francisco, CA",filemap.net
Fzata,Pre-Clinical Trials,10,"Developer of an oral biologics platform designed for oral biologics administration. The company's technology utilizes live recombinant yeast to express and secrete therapeutic biologics and enjoys vast manufacturing savings, no cold chain, no needles, and avoids systemic toxicity and anti-drug antibody response for a high safety profile, thereby enabling patients to fight against gastrointestinal-related disorders.","Fzata, Inc.",,Healthcare,1450 South Rolling Road,"Halethorpe, MD",www.fzata.com
