company,businessStatus,employees,description,legalName,revenue,primaryIndustrySector,hqAddressLine1,hqLocation,companyWebsite
Gmork Tech,Generating Revenue,3,"Developer and provider of industrial automation and information systems and services designed to help clients unlock the potential of industrial networks. The company specializes in business automation and offers a range of solutions such as human-machine interfaces, programmable logic controllers, power supply units, industrial automation sensors, and information systems hardware, and also offers a solutions platform that monitors and controls industrial and manufacturing networks in real-time.",Gmork Tech LLC,,Information Technology,549 Summit Avenue,"Hagerstown, MD",www.gmork.tech
HerSecure,Generating Revenue,3,"Developer of a medical device designed to help women suffering from urinary incontinence. The company's external medical device has a pressure guard that helps prevent leakage before it starts, avoiding the need to mask any longer.","HerSecure, Inc",,Healthcare,,"Fort Lauderdale, FL",www.hersecurehealth.com
Ionic ST,,3,"Operator of live online fitness classes, offering virtual HIIT classes and mindset coaching to individuals seeking simplified fitness training, nutrition, and goal setting.",,,Business Products and Services (B2B),8100 Boteler Ln,"College Park, MD",ionicst.com
LICA-Tech,Out of Business,3,The company is currently operating in stealth mode.,,,Business Products and Services (B2B),,"Pittsburgh, PA",www.lica-tech.com
Microsphere Material Solutions,Startup,3,"Operator of a materials-focused tech transfer company intended to develop, mature, and commercialize early-stage to solve critical commercial and government problems. The company specializes in modeling, fabrication, and testing hollow microspheres and bulk foams from metals and silicate glasses, enabling the organization with leading-edge high-performance lightweight foam materials.",Microsphere Material Solutions LLC,,Materials and Resources,7226 Old Gate Road,"Rockville, MD",www.microspheresolutions.com
Nanochon,Clinical Trials - Phase 1,3,"Developer of medical devices and other technology intended to treat joint injuries and diseases. The company's devices replace lost and damaged cartilage and encourage new tissue growth, enabling medical practitioners to access cost-effective and on-demand devices that improve outcomes in young and active patients with knee damage.","Nanochon, Inc.",,Healthcare,7144 13th Place Northwest,"Washington, DC",www.nanochon.com
Nicelle Technologies,Startup,3,"Developer of a clean technology company intended to revolutionize the textile fiber industry through innovation and sustainability. The company specializes in developing fiber production and recycling techniques and minimizing environmental impact, enabling the textile industry to reduce waste and emissions throughout the production cycle.","Nicelle Technologies, LLC.",,Materials and Resources,,"Raleigh, NC",www.nicelletech.com
OcuClips,Stealth,3,"Operator of an eyewear company based in Ellicott City, United States. The company is currently operating in stealth mode.",OcuClips LLC,,Consumer Products and Services (B2C),,"Ellicott City, MD",www.ocuclips.com
Paterson Aerospace Systems,Startup,3,"Developer of space exploration technology designed to build a future where space exploration is sustainable. The company offers research and development technologies that address challenges in space travel, potentially aiming for a sustainable human presence beyond Earth, enabling the company to progress in areas like spacecraft propulsion, resource utilization in space, or life support systems for space habitats.",Paterson Aerospace Systems Limited,,Business Products and Services (B2B),,"Wilmington, DE",www.patersonaerospace.com
PathoVax,Generating Revenue,3,"Developer of an HPV vaccine designed to combat infectious diseases. The company's product is a broad-spectrum vaccine for the treatment of human papillomavirus, enabling users to get cured of various contagious diseases.",PathoVax LLC,,Healthcare,1812 Ashland Avenue,"Baltimore, MD",www.pathovax.com
Pirl,Generating Revenue,3,"Developer of electric vehicle charging devices designed to offer a sustainable alternative for electric vehicles. The company offers services that accelerate humanity's transition to a future of clean, electric transport by developing a next-generation electric vehicle charging infrastructure, enabling customers to assist with the transition to electric vehicles.",Pirl Technology Inc.,,Information Technology,219 Harpers Way,"Frederick, MD",www.pirlcharger.com
QubitSolve,Product Development,3,"Developer of computational fluid dynamics (CFD) simulation software for quantum computers. The company's variational quantum algorithm helps solve Navier-Stokes equations, the fundamental basis of almost all CFD simulations, enabling a new class of Quantum CFD solutions to currently intractable problems.","QubitSolve, Inc.",,Business Products and Services (B2B),781 Chestnut Ridge Road,"Morgantown, WV",www.qubitsolve.com
RemBac Environmental,Generating Revenue,3,Provider of site remediation products intended for in situ bioremediation of sediments and soils contaminated with polychlorinated biphenyls. The company assesses the PCB-impacted site to determine whether bioremediation is a suitable treatment option either alone or in combination with other treatment options and provides the required dosage of microorganisms and activated carbon to treat the PCB-contaminated site.,RemBac Environmental LLC,,Business Products and Services (B2B),3140 Edgewood Road,"Howard County, MD",www.rembac.com
Renalert,Startup,3,"Developer of a kidney monitoring system designed to prevent needless deaths due to acute kidney injury. The company's system monitors patient urine precisely measuring the volume while correlating these values with other vital signs to estimate renal perfusion and it also incorporates a proprietary algorithm to detect early declines in kidney function, enabling medical professionals to detect acute kidney injury easily and offer treatment accordingly.","Renalert, LLC.",,Healthcare,101 West Dickman Street,"Baltimore, MD",www.renalert.co
True Bearing Diagnostics,Generating Revenue,3,"Developer of a blood testing tool designed to detect coronary diseases at an early stage. The company's tool senses immune imbalances in blood with accuracy, enabling doctors to increase diagnostic accuracy, expanded access to a currently inaccessible patient pool, and significantly reduce, the expensive and invasive requirement for multiple tests to diagnose CAD.","True Bearing Diagnostics, Inc.",7.00,Healthcare,2450 Virginia Avenue,"Washington, DC",www.truebearingdiagnostics.com
UpTahr Analytics,,3,"Uptahr LLC, a technology consulting firm, offers custom software development, data science, and AI solutions. Their services include web and mobile engineering, chatbot integrations, and data analysis and visualization. BlueOne, another technology company, also provides similar services in web and mobile engineering, chatbot integrations, and data analysis and visualization.",,,Business Products and Services (B2B),387 Technology drive,"College Park, MD",uptahr.com
Virtual Apprentice,Generating Revenue,3,"Provider of virtual reality training services intended to optimize workforce training through virtual reality. The company provides immersive and interactive training experiences that are designed to help businesses improve their workforce training, enabling businesses to close the workforce talent gap, and is grounded in adult learning theory.",Virtual Apprentice LLC,,Business Products and Services (B2B),1 Research Court,"Rockville, MD",www.virtualapprentice.net
1787fp,Generating Revenue,2,"Operator of a fintech company intended to provide a financial management platform for investors. The company's platform combines three powerful financial management tools finance tracking, investment management, and credit monitoring all unified in one platform, enabling investors to work towards financial independence and take control of their finances.","1787 Financial Corporation, Inc.",,Information Technology,2231 Crystal City Drive,"Arlington, VA",www.1787fp.co
ACUITYnano,Generating Revenue,2,"Operator of a scientific R&D-centric company intended to offer solutions for the exploration and manipulation of the nano- and micro world in which life functions. The company leverages advanced embedded systems and control algorithms, computer vision, and machine learning in conjunction with microfluidics and optics and offers consultancy, product development, and technology and IP transfer to meet the critical needs that emerge at the convergence of nanotechnology and life sciences, thereby helping clients to identify business value drivers that will be key for turning ideas into innovation and into commercial performance to solve pressing challenges in health and medicines.",ACUITYnano LLC,,Healthcare,5425 Wisconsin Avenue,"Chevy Chase, MD",www.acuitynano.com
Advanced Biomimetic Sensors,,2,"Developer of medical diagnostic and monitoring technologies. The company's objective is to create and improve medical devices for various diseases. They design, produce, and market their products. The company is located at 6710A Rockledge Drive, Suite 400, Unit 405, Bethesda, MD 20817.",Advanced Biomimetic Sensors Inc,,Healthcare,11140 Rockville Pike,"Rockville, MD",abs-isensors.com
Advancing Synergy,,2,"Developer of health equity solutions that improve long-term health outcomes. Advancing Synergy leverages research, science, health care, public health, and information technology to develop innovations that engage individuals and impact communities. The company is committed to eliminating health disparities to achieve health equity and justice. Their tailored programmatic and strategic support delivers effective solutions to clients.",,,Business Products and Services (B2B),1450 S Rolling Rd,"Baltimore, MD",advancingsynergy.com
Aevus Precision Diagnostics,Generating Revenue,2,"Developer of an artificial intelligence (AI) powered prescription guidance platform intended to improve type 2 diabetes (T2D) drug outcomes, reduce medication switching, and lower treatment costs. The company's platform specializes in precision medicine, adverse drug reactions, machine learning, and personalized medicine, enabling patients to reduce the burden by limiting medication switching, minimizing side effects, and matching them to a suitable available drug.","Aevus Precision Diagnostics, Corp.",,Healthcare,3301 12th Avenue South East,"Norman, OK",www.aevus.ai
AliquantumRx,Clinical Trials - Phase 3,2,"Operator of a drug discovery platform designed to treat liver-stage malaria. The company's platform develops a macrolide for new use as a treatment for several diseases where it has significant potential to provide valuable new treatments, enabling people to get protection against clinical and harmful illnesses.",AliquantumRx Inc.,,Healthcare,1812 Ashland Avenue,"Baltimore, MD",www.aliquantumrx.com
Barter Black,Generating Revenue,2,"Developer of a barter marketplace platform designed to empower Black entrepreneurs. The company's platform allows Black entrepreneurs to exchange services and goods using a secure, internal digital currency called Barter Bucks by eliminating the need for upfront cash and allows members to conserve financial resources, enabling users to enhance their business capabilities.","Barter Black, LLC",,Information Technology,10127 Prince Place,"Upper Marlboro, MD",www.barterblack.io
Blimp (Logistics),Generating Revenue,2,"Operator of a logistics company intended to specialize in drone-based delivery and logistics services. The company offers transport large and heavy payloads services and also provide respond to emergencies, making them valuable for disaster relief and other critical situations, enabling to help client to be secure and safe about their products.",Blimp Logistics Inc.,,Business Products and Services (B2B),9011 Gettysburg Lane,"College Park, MD",www.blimplogistics.com
CIDE KIC,Generating Revenue,2,"Operator of a kitchen management platform designed to administrate true visibility and complete insight into day-to-day operations in the kitchen. The company's digital platform integrates all aspects of kitchen management and operates interactive tools for onboarding and training and converts to workflow consistency and transparency, enabling professional chefs to improve compliance, mitigate potential risks, improve autonomy, and capture critical data within their customer database.","Cide Kic, Inc.",,Information Technology,1833 New Hampshire Avenue,"Washington, DC",www.cidekic.com
Coordle,Generating Revenue,2,"Developer of a group travel platform designed to create a seamless inclusive travel experience as an intuitive, hassle-free, complete ecosystem. The company's platform provides travel alerts and reminders and solves the problem of managing documents, finding places to eat, getting up-to-date travel information and group chats, enabling travelers to get access to a central location to manage all their information related to trips and assistance for all of their needs.",Coordle LLC,,Information Technology,8 The Green,"Dover, DE",www.coordleapp.com
Cursive (Educational Software),Startup,2,"Operator of an education technology company intended to uncover a student's true writing skills. The company offers seamless biometric authentication, ensuring consistent identification of students throughout their academic writing, enabling teachers and students to show 'proof of effort' for writing in the classroom and bringing authorship back to the forefront.","Cursive Technology, Inc.",0.01,Information Technology,2600 East Baltimore Street,"Baltimore, MD",www.cursivetechnology.com
Djit Medtech,Product In Beta Test,2,"Developer of finger joint implant device intended for arthritis patients. The company's device relieves pain and preserves motion for all types of hand arthritis, enabling patients to make joint replacement for fingers as routine and reliable as knee and hip replacements.","Djit Medtech, Inc.",,Healthcare,1628 Bolton Street,"Baltimore, MD",www.djit-medtech.com
DNA Analytics,Generating Revenue,2,"Developer of AI analytics platform intended for gene therapies, vaccines, and diagnostics. The company's platform will improve the prediction of gene probe match strength and effect of locked nucleic acids and chemical modifications on CRISPR, siRNA, and antisense guide strands, enabling scientists to model gene probe sequences, and through statistical algorithms.","DNA Analytics, Inc.",,Information Technology,10 Lakeview Circle,"Greenbelt, MD",dnaanalytics.com
Door Robotics,Startup,2,"Manufacturer of virtual reality drones designed to take pictures and videos. The company's drones capture 360-degree footage and convert it into standard video and also offer live virtual reality streaming, enabling users to get a hands-free way to capture the full scenario.","Door Robotics, Inc.",,Information Technology,6 Florida Avenue North West,"Washington, DC",doorrobotics.launchrock.com
"Drakeford, Scott & Associates",Generating Revenue,2,"Operator of an e-learning platform intended to provide research-driven services. The company's platform provides online courses and lives courses for research
grant and bid writing, enabling people to find their purpose and launch a business or nonprofit.","Drakeford, Scott & Associates LLC",,Consumer Products and Services (B2C),221 East Indianola Avenue,"Phoenix, AZ",www.drakefordassociates.org
Enerytics,,2,"Developer of energy management software-as-a-service solutions. Enerytics' objective is to optimize energy demand management strategies in commercial and industrial facilities, with a focus on facilitating GEB adoption. The company offers solutions to help businesses reduce energy consumption and costs, while also improving sustainability and compliance.",,,Information Technology,,"Potomac, MD",enerytics.com
Epsilon Innovation,Generating Revenue,2,"Provider of consulting services in energy, climate change, environment, policy, and risk analysis. The firm offers customized data analytics tools, policy analysis, and economic development services to clients. They also provide services related to climate resilience data analytics, energy workforce planning, and renewable energy system designs. The company has a team of experts, scientists, and consultants who work globally, serving international and national governments and emerging markets.",,,Information Technology,,"Mukilteo, WA",epsiloninnovation.com
Freshmeet U,Generating Revenue,2,"Developer of an AI-based learning and job placement platform designed to serve the creative freelancers. The company offers a range of corporate creative videos, sports shows, films, and featured artists.","Freshmeet U., L.L.C.",,Consumer Products and Services (B2C),Reisterstown,MD,www.freshmeetu.com
InfraTrac,Generating Revenue,2,"Developer of a chemical tagging technology intended to reduce counterfeiting, and enable instant field authentication. The company's technology uses spectroscopy to detect and prevent counterfeiting of high-value regulated materials including aerospace parts and pharmaceuticals, enabling companies to take tracking and anti-counterfeiting measures and differentiate the fakes from the real products.","InfraTrac, Inc.",,Materials and Resources,Silver Spring Innovation Center,"Silver Spring, MD",www.infratrac.com
Journiy,Generating Revenue,2,Developer of digital care management platform and provider of healthcare services designed for chronic care management. The company's application provides a diverse selection of healthy food recipes that align with the culinary preferences and cultural backgrounds of the users and offers chronic care management to remote patient monitoring to transition care management services.,,,Healthcare,Montgomery Village,"Gaithersburg, MD",www.journiywellness.com
Linksciences,Generating Revenue,2,"Operator of a data-driven scientific network intended to develop integrated tools for science and medicine. The company offers services such as free antibody citation, premium web listing, product citation tracking, business intelligences services, targeted research data services and customized research data alternative, clients to get wealth of information connections, and tools to accelerate research, collaboration, and innovation.","Linksciences, LLC",,Healthcare,701 East Pratt Street,"Baltimore, MD",www.linksciences.com
Materic,Generating Revenue,2,"Manufacturer and designer of custom materials intended to provide manufacturing, joint development programs, and products. The company designs and manufactures materials and specializes in electrospinning, nanoparticle separation, textile treatments, 3D printing materials, specialty ink, and microencapsulation, enabling clients to access custom equipment in various disciplines.","Materic, LLC",,Business Products and Services (B2B),1300 Bayard Street,"Baltimore, MD",www.matericgroup.com
NDN International,Generating Revenue,2,"Developer of a portable hand washing station designed for parks, schools, offices, restaurants, residential homes, emergency shelters, and more. The company device is intended to be used without electricity, or running water, and also does not need foot pumping, making it easily accessible to children, adults, and wheelchair-bound consumers.",NDN International LLC,,Business Products and Services (B2B),12016 Great Elm Drive,"Potomac, MD",www.ndninterntl.com
Open Dollar,Generating Revenue,2,"Developer of a protocol platform designed to offer access to simple and predictable loans. The company's platform allows users to borrow against liquid staking tokens and arbitral native assets with flexible and transparently over-collateralized stablecoin as well as over-collateralized with a stable value maintained through proactive debt repricing, enabling clients and users to leverage their liquid staking tokens with the flexible stablecoin protocol.",Nifty Chess Inc.,,Information Technology,1779 Kirby Parkway,"Memphis, TN",www.opendollar.com
Ovalz,Out of Business,2,"Developer of an inventory management platform designed to help every business gain economic insight from its data. The company's platform digitally manages audit activity across selling channels like an e-commerce site, store, or mobile application and syncs the reported inventory quantities by site location, enabling companies to increase sales through detailed insights.","Ovalz, Inc.",,Information Technology,7761 Diamondback Drive,"College Park, MD",www.ovalz.io
Phase (Cornelius),Generating Revenue,2,Manufacturer of 3D printing technology for microfluidics that create more realistic biological environments. The company helps to create microfluidics in the industry-standard material at a speed and resolution to create true biological models that propel bio innovation across the biotech industry.,,,Healthcare,11148 Treynorth Drive,"Cornelius, NC",www.phase.am
Physics Inverted Materials,,2,"The company primarily operates in the Operating Systems Software industry. Physics Inverted Materials is headquartered in Pittsburgh, PA.",,,Information Technology,,"Pittsburgh, PA",phinmaterials.com
Pocket Plan,Generating Revenue,2,"Developer of a web-based financial planning platform designed to create, manage, and share financial plans. The company's platform offers a range of features including financial plan creation, real-time reports, client data management, advisor network, lead generation, project management, scheduling integration, and more, enabling freelancers and entrepreneurs to manage their finances more efficiently and make informed decisions while achieving their goals.",Pocket Planner Inc,,Information Technology,5850 Waterloo Road,"Columbia, MD",www.pocketplan.io
Prommuni,Generating Revenue,2,"Operator of social networking platforms intended to in assist in finding roommates. The company's all-in-one platform integrates a professional's personal, rooming, and networking needs and has a chat feature to discuss and share preferences, enabling users to find roommates using an algorithm of their preferences.",,,Consumer Products and Services (B2C),,"Washington, DC",prommuni.com
Redhelm Labs,Startup,2,"Developer of a defense tech designed to transform the drone industry. The company specializes in laser drone, empowering businesses and individuals with safe, and sustainable aerial solutions.",Redhelm Labs LLC,,Business Products and Services (B2B),8125 48th Avenue,"College Park, MD",www.redhelmlabs.com
Revolve Biotechnologies,Out of Business,2,"Developer of a protein and nucleic acid evolution technology designed to produce custom DNA libraries. The company's platform develops an ultra-affinity antibody discovery engine with a pipeline of protein products in development, enabling healthcare researchers to create antibodies for diagnostic and therapeutic applications, oncolytic cancer therapeutics, and infrared fluorescent proteins for live deep-tissue imaging.","Revolve Biotechnologies, Inc.",,Healthcare,1100 Wicomico Street,"Baltimore, MD",www.revolvebiotech.com
Rise Technology,Generating Revenue,2,"Developer of closed-loop electrostimulation technology designed to advance human body wellness and disease control applications. The company offers cutting-edge, wearable electrostimulation devices, enabling individuals seeking wellness and therapeutic relief to experience enhanced health benefits.",Rise Technology Inc.,,Healthcare,2710 Crow Canyon Road,"San Ramon, CA",www.myrisetech.com
Sanyal Biotechnology,Generating Revenue,2,"Provider of contract research services to clients seeking small animal models for their pre-clinical research. The company offers preclinical research into liver disease and other comorbidities resulting from metabolic syndrome and develops customized studies to provide a professional interpretation of data, enabling clients to receive a professional interpretation of customized studies based on screening of the desired compounds.",Sanyal Biotechnology LLC,2.14,Healthcare,3645 East Faculty Boulevard,"Virginia Beach, VA",www.sanyalbio.com
Scinetics,,2,"The company primarily operates in the Media and Information Services (B2B) industry. Scinetics is headquartered in Abingdon, MD.","Scinetics, Inc.",,Business Products and Services (B2B),,"Abingdon, MD",scineticsinc.com
Second Star Robotics,,2,"Developer of autonomous robotics solutions for ocean observation. Second Star Robotics provides low-cost, long-endurance sensing platforms for data collection in the oceans' twilight zone. Their products serve markets such as academic research, media production, utilities, and energy.",,,Business Products and Services (B2B),2333 Distribution Circle,"Silver Spring, MD",secondstarrobotics.com
Sensing Machines,Generating Revenue,2,"Provider of an engineering consulting service intended to create and develop the technology. The company offers engineering design services specializing in printed circuit board(PCB) design, microelectromechanical systems(MEMS) design, and packaging services, enabling clients to meet their demands on time and within their budget.",Sensing Machines LLC,,Business Products and Services (B2B),12010 Hammonds Glen Circle,"Kingsville, MD",www.sensing-machines.com
SpherIngenics,Out of Business,2,"Developer of microbead technology designed to produce protective capsules for the delivery of cell-based therapies. The company's technology ensures that the cells are localized at the targeted area and maintain continued viability after injection, enabling healthcare professionals to help patients by repairing the majority of these therapeutic cells through cell-based therapy.","SpherIngenics, Inc.",,Healthcare,313 Ferst Street,"Atlanta, GA",www.spheringenics.com
