company,dealPbId,dealDate,dealSize,dealSizeStatus,investors,dealType,dealSynopsis
Cykloburn Technologies,113635-00T,05-Sep-2018,,,F3 Tech Business Accelerator,Accelerator/Incubator,"The company joined F3 Tech Business Accelerator on September 5, 2018."
Cykloburn Technologies,223601-50T,01-Jan-2017,,,Morgan State University,University Spin-Out,"The company was spun out of Morgan State University on January 01, 2017."
Cykloburn Technologies,253290-97T,31-May-2019,0.23,Actual,National Science Foundation,Grant,"The company received $225,000 of grant funding from National Science Foundation on May 31, 2019."
Cykloburn Technologies,255106-09T,17-Mar-2024,,,,Out of Business,"The company is no longer actively in business as of March 17, 2024."
Datasembly,54679-06T,04-Sep-2014,,,Halcyon Incubator,Accelerator/Incubator,"The company joined Halcyon Incubator on September 4, 2014."
Datasembly,54680-05T,31-Jul-2015,0.13,Actual,500 Global (David McClure),Accelerator/Incubator,"The company joined 500 Global on July 31, 2015 and received $125,000 in funding, putting the company's pre-money valuation at $2.37 million ."
Datasembly,67319-65T,01-Mar-2016,,,Plug and Play Tech Center,Accelerator/Incubator,"The company joined Plug and Play Ventures as part of Batch 5 on March 1, 2016."
Datasembly,110158-30T,19-Jul-2018,1.86,Actual,"500 Global, Bryan Rosenblatt (Bryan Rosenblatt), Evan Brown (Evan Brown), Forefront Venture Partners, Halcyon Incubator, LaunchCapital, Plug and Play Tech Center",Seed Round,"The company raised $1.86 million through a combination of Seed-1, Seed-2 and Seed-3 funding from Forefront Venture Partners, LaunchCapital and 500 Global on July 19, 2018, putting the company's pre-money valuation at $5 million. Plug and Play Tech Center, Halcyon Incubator, Evan Brown and Bryan Rosenblatt also participated in the round."
Datasembly,136818-19T,19-May-2020,10.32,Actual,"Craft Ventures (David Sacks), Evan Brown (Evan Brown), Food Retail Ventures, Valor Equity Partners",Later Stage VC,"The company raised $10.32 million of Series A venture funding in a deal led by Craft Ventures on May 19, 2020, putting the company's pre-money valuation at $33 million. Valor Equity Partners, Food Retail Ventures and Evan Brown also participated in the round.The funds will be used to accelerate product development and expand sales and marketing efforts."
Datasembly,155196-01T,27-Apr-2020,0.22,Actual,,Debt - PPP,"The company was approved for a $218,564 Paycheck Protection Program Loan from First Citizens BancShares on April 27, 2020. The application cited 16 jobs to be retained with the financing."
Datasembly,183699-82T,18-Nov-2021,7.00,Actual,"Evan Brown (Evan Brown), LaunchCapital, Twenty5Twenty, Valor Equity Partners (Richard Tait)",Later Stage VC,"The company raised $7 million of Series A1 venture funding from Valor Equity Partners, Twenty5Twenty and LaunchCapital on November 18, 2021, putting the company's pre-money valuation at $53 million Evan Brown also participated in the round. The funds will be used to hire new employees in the engineering and sales operations departments and to heavily invest in its marketing and growth strategies for the long term."
Datasembly,220929-22T,01-May-2023,20.73,Actual,"Composite Ventures, Grotech Ventures (Lawson DeVries), Noro-Moseley Partners (Vasant Kamath), Portfolia, Staley Capital, Teamworthy Group, Topmark Partners",Later Stage VC,"The company raised $20.73 million of through a combination of Series B-1 and Series B-2 venture funding in a deal led by Noro-Moseley Partners on May 1, 2023, putting the company's pre-money valuation at $64 million. Staley Capital, Teamworthy Group, Portfolia, Composite Ventures, Grotech Ventures and Topmark Partners also participated in the round."
DeepMirror (Business/Productivity Software),134056-36T,25-Mar-2020,,,,Angel (individual),"The company raised USD millions of angel funding from Fei Yang and other undisclosed investors on March 25, 2020."
DeepMirror (Business/Productivity Software),140175-28T,23-Jul-2020,,,Volcanics Venture,Early Stage VC,"The company raised USD millions of venture funding from Volcanics Venture on July 23, 2020."
DeepMirror (Business/Productivity Software),173530-99T,06-Mar-2021,,,"Eight Roads, Fosun RZ Capital, GAC Capital, Oppo, SAIC Capital China, Sunwoda Electronic Co (SHE: 300207), Volcanics Venture, Yuexiu Financial Holdings",Early Stage VC,"The company raised USD tens of millions of venture funding in a deal led by Oppo, GAC Capital and Eight Roads on March 6, 2021. SAIC Capital China, Sunwoda Electronic Co, Yuexiu Financial Holdings, Fosun RZ Capital and Volcanics Venture also participated in the round. The funds will be used for R&D, talent acquisition and equipment procurement."
DeepMirror (Business/Productivity Software),188170-75T,09-Feb-2022,,,"37Games (SHE: 002555), Eight Roads, Fosun RZ Capital, IDG Capital, IMO Ventures, Lingang Sc-innovation Investment (Wei Wu), Oppo, Sunwoda Electronic Co (SHE: 300207)",Early Stage VC,"The company raised USD tens of millions of Series A venture funding in a deal led by Lingang Sc-innovation Investment and IDG Capital on February 9, 2022. IMO Ventures, Oppo, Sunwoda Electronic Co, 37Games, Eight Roads, Fosun RZ Capital and BV Capital also participated in the round. The funds will be used for technology research and development, product implementation and talent recruitment."
DeepMirror (Business/Productivity Software),217675-00T,01-Oct-2022,0.29,Actual,Innovate UK,Grant,"The company received a GBP 257,297 grant from Innovate UK on October 1, 2022."
Djit Medtech,234424-36T,23-Aug-2023,0.14,Actual,,Angel (individual),"The company raised $140,000 of angel funding in the form of SAFE Notes from undisclosed investors on August 23, 2023."
Djit Medtech,234426-97T,14-Dec-2022,0.02,Actual,LifeX Ventures,Accelerator/Incubator,"The company joined LifeX (United States) on December 14, 2022 and received $20,000 in funding."
Djit Medtech,234429-58T,25-May-2023,0.01,Actual,TEDCO,Grant,"The company received $6,000 of grant funding from TEDCO on May 25, 2023."
Djit Medtech,242027-74T,01-Aug-2023,0.10,Actual,Maryland Industrial Partnerships,Grant,"The company received $100,000 of grant funding from Maryland Industrial Partnerships and other undisclosed grantor on August 1, 2023."
Djit Medtech,269070-40T,01-Jan-2023,,,Creative Destruction Lab,Accelerator/Incubator,The company joined Creative Destruction Lab in 2023. No equity or funding was exchanged as a result of this program.
DNA Analytics,40768-75T,14-Aug-2006,,,Maryland Industrial Partnerships (Martha Connolly),Accelerator/Incubator,"The company joined Maryland Industrial Partnerships on August 14, 2006."
DNA Analytics,40769-56T,01-Jan-2007,1.04,Actual,,Grant,The company received $1.04 million of grant funding from undisclosed grantees in 2007.
DNA Analytics,40769-74T,01-Jan-2011,0.92,Actual,,Grant,"The company received $919,971 of grant funding from undisclosed grantees in 2011."
