company,dealPbId,dealDate,dealSize,dealSizeStatus,investors,dealType,dealSynopsis
Astek Diagnostics,190551-52T,18-Mar-2022,0.35,Actual,TEDCO (Jean-Luc Park),Early Stage VC,"The company raised $345,000 of venture funding from TEDCO and other undisclosed investors on March 18, 2022. The funding was initially raised in the form of convertible debt and subsequently got converted into equity."
Astek Diagnostics,199494-19T,01-May-2022,,,National Science Foundation,Accelerator/Incubator,"The company joined National Science Foundation on May 1, 2022."
Astek Diagnostics,220117-60T,21-Aug-2023,3.10,Actual,"Abell Foundation, Ayana Capital, Biomedical Advanced Research and Development Authority, Goldin Ventures, Harvard Management Company, Maryland Industrial Partnerships, Maryland Innovation Initiative, National Institutes of Health, TEDCO (Theodore Gresser), The University System of Maryland Momentum Fund, U.S. Food and Drug Administration, Wexford Science & Technology (Thomas Osha)",Early Stage VC,"The company raised $3.1 million of venture funding in a deal led by Wexford Science & Technology on August 21, 2023. Maryland Innovation Initiative, Ayana Capital, The University System of Maryland Momentum Fund, Abell Foundation, TEDCO, University of Maryland, Baltimore County, Goldin Ventures, Harvard Management Company, U.S. Food and Drug Administration, Biomedical Advanced Research and Development Authority, National Institutes of Health and Maryland Industrial Partnerships also participated in the round. The funds will be used to support the development and launch of a medical device designed for the speedy recovery of patients suffering from urinary tract infections (UTIs)."
Astek Diagnostics,234817-48T,16-Jun-2020,0.15,Actual,,Seed Round,"The company raised $150,000 of seed funding from undisclosed investors on June 16, 2020. The amount was initially raised in the form of a combination which subsequently got converted to equity."
Astek Diagnostics,245478-79T,08-Mar-2024,2.00,Actual,"Abell Foundation, Ayana Capital (Angel Kelchev), Goldin Ventures, Harvard Management Company, Key Technologies, Maryland Industrial Partnerships, Maryland Innovation Initiative, She's Independent, TEDCO (Theodore Gresser), The University System of Maryland Momentum Fund, Wexford Science & Technology (George Davis), Y Combinator",Early Stage VC,"The company raised $2 million of venture funding in a deal led by She's Independent on March 8, 2024, putting the company's pre-money valuation at an estimated $15 million. Key Technologies, Maryland Innovation Initiative, The University System of Maryland Momentum Fund, TEDCO, Ayana Capital, Abell Foundation, Y Combinator, Wexford Science & Technology, Goldin Ventures, Maryland Industrial Partnerships, and Harvard Management Company also participated in the round."
Astek Diagnostics,248417-02T,01-Oct-2023,,,"National Science Foundation, National Science Foundation Innovation Corps Program",Accelerator/Incubator,The company joined National Science Foundation Innovation Corps Program and National Science Foundation as a part of their NSF I-Corps Fall 2023 Program and NSF SBIR Fall Boot Camp in October 2023.
Astek Diagnostics,248421-61T,01-Jan-2023,0.27,Actual,National Science Foundation,Grant,"The company received $274,587 of grant funding from National Science Foundation in 2023."
Astek Diagnostics,264400-03T,29-May-2024,,,MedTech Innovator (Paul Grand),Accelerator/Incubator,"The company joined MedTech Innovator as part of its MedTech Innovator US 2024 Cohort on May 29, 2024. No equity or funding was exchanged as a result of this program."
Auxergen,170572-33T,24-May-2023,0.56,Actual,,Seed Round,"The company raised $560,000 of seed funding from undisclosed investors on May 24, 2023."
Auxergen,248607-46T,,0.29,Actual,,Angel (individual),"The company raised $290,000 of angel funding on an undisclosed date."
Avasys,93981-25T,,,,Johns Hopkins Technology Ventures,Accelerator/Incubator,The company joined Fast Forward at Johns Hopkins University on an undisclosed date.
Avasys,93983-77T,01-Mar-2016,,,TEDCO,Grant,The company received an undisclosed amount of grant funding from TEDCO in March 2016.
Awarables,75611-53T,13-Sep-2016,0.50,Actual,Abell Foundation (Robert Embry),Early Stage VC,"The company raised $500,000 of seed funding from The Abell Foundation on September 13, 2016, putting the company's pre-money valuation at $4.5 million. The funds will be used to hire new engineers and management staff to help move that project forward."
Awarables,75614-14T,30-Jun-2016,0.15,Actual,National Science Foundation,Grant,"The company received $149,941 of grant funding from National Science Foundation on June 30, 2016."
Awarables,75614-41T,10-Nov-2015,,,"National Science Foundation, New England Pediatric Device Consortium",Grant,"The company received an undisclosed amount of grant funding as a part of 2015 NEPDC Target Challenge from New England Pediatric Device Consortium and National Science Foundation on November 10, 2015."
Awarables,75642-22T,01-Jan-2015,,,Springboard Enterprises,Accelerator/Incubator,"The company joined Springboard Enterprises on January 1, 2015."
Awarables,187996-42T,18-Jun-2015,0.30,Actual,National Science Foundation,Grant,"The company received $297,628 of grant funding from National Science Foundation on June 18, 2015."
Awarables,218323-45T,06-Mar-2017,,,,Out of Business,"The company is no longer actively in business as of March 6, 2017."
Barter Black,275606-74T,05-May-2022,,,Founders First CDC,Accelerator/Incubator,"The company joined Founders First CDC as a part of its kitty fund grant program on May 5, 2022 and received an undisclosed amount of funding in the form of grant."
Barter Black,275606-83T,28-Mar-2024,0.01,,The Universities at Shady Grove,Accelerator/Incubator,"The company joined The Universities at Shady Grove on March 28, 2024 and received $3,000 in funding."
Bashpole Software,113719-42T,01-Jan-2016,5.52,Actual,United States Department of Defense,Grant,The company received $5.52 million of grant funding from United States Department of Defense in 2016.
BEIT,124282-45T,01-Oct-2019,1.40,Actual,"Bloomberg Beta, Charles Songhurst (Charles Songhurst), DCVC, Firebolt Ventures, George Armoyan (George Armoyan), Kindred Capital, Manta Ray Ventures, S28 Capital",Seed Round,"The company raised $1.4 million of seed funding in a deal led by Kindred Capital on October 1, 2019. Bloomberg Beta, S28 Capital, DCVC, Manta Ray Ventures, Firebolt Ventures, Charlie Songhurst and George Armoyan also participated in the round. The funds will be used for the development and implementation of an effective algorithm for solving NP-complete problems on quantum computers."
BEIT,124302-52T,01-Jan-2014,2.60,Actual,European Union,Grant,The company received $2.6 million of grant funding from European Union in 2014.
BEIT,165005-92T,12-Jun-2019,,,Creative Destruction Lab,Accelerator/Incubator,"The company joined Creative Destruction Lab on June 12, 2019."
BEIT,246778-48T,10-Nov-2023,1.06,Actual,"Bitspiration Booster, Tensor Ventures",Seed Round,"The company raised $1 million of seed funding from Bitspiration Booster & Tensor Ventures on November 10, 2023."
BEIT,255228-58T,11-Jan-2023,2.66,Actual,European Innovation Council Fund,Grant,"The company received EUR 2.5 million of grant funding from European Innovation Council Fund on January 11, 2023."
BEIT,265360-60T,01-Jan-2022,,,The World Economic Forum,Accelerator/Incubator,The company joined The World Economic Forum in 2022. No equity or funding was exchanged as a result of this program.
BioBind,172613-53T,01-Apr-2021,,,National Science Foundation Innovation Corps Program,Accelerator/Incubator,The company joined National Science Foundation Innovation Corps Program as part of its NSF I-Corps Spring 2021 program in April 2021.
Biokmir,228364-66T,16-Nov-2018,0.01,Actual,The Do Good Institute,Grant,"The company received $500 of grant funding as a part of Do Good Mini-Grant program from The Do Good Institute on November 16, 2018. The funds will be used to fund a trip to Morocco to build relationships with the government and other stakeholders to partner on this project."
Biokmir,228383-83T,01-May-2023,,,National Science Foundation Innovation Corps Program,Accelerator/Incubator,The company joined the NSF I-Corps Spring 2023 Program in May 2023 and received an undisclosed amount of funding.
Biokmir,281642-23T,14-Nov-2020,,,U-FOUNDERS,Accelerator/Incubator,"The company joined U-FOUNDERS as a part of U-Founders 2020 cohort on November 14, 2020."
Blimp (Logistics),246744-01T,16-Jul-2020,0.01,Actual,Robert H. Smith School of Business,Accelerator/Incubator,"The company joined Robert H. Smith School of Business on July 16, 2020 and received $5,000 in funding in the form of grant."
Blimp (Logistics),246744-46T,05-May-2021,0.03,Actual,Robert H. Smith School of Business,Grant,"The company received $30,000 of grant funding from Robert H. Smith School of Business on May 5, 2021."
Blimp (Logistics),246744-82T,18-Oct-2021,0.01,Actual,Shatter Fund,Grant,"The company received $5,000 of grant funding from Shatter Fund on October 18, 2021."
Blimp (Logistics),288561-88T,12-Sep-2024,,,Capital One Financial (NYS: COF),Accelerator/Incubator,"The company graduated from Capital One Financial as part of its 2024 Accelerator Program on September 12, 2024. No equity or funding was exchanged as a result of this program."
Blimp (Logistics),288562-69T,01-Jul-2024,,,Startup Shell,Accelerator/Incubator,The company joined Startup Shell in July 2024. No equity or funding was exchanged as a result of this program.
Blue Rose Consulting Group,197595-55T,12-Mar-2021,0.40,Actual,,Debt - General,"The company received $400,000 of debt financing in the form of a loan from Customers Bank on March 12, 2021."
Bluelene,120564-28T,02-Jul-2019,0.15,Actual,TEDCO (George Davis),Early Stage VC,"The company raised $150,000 of venture funding from TEDCO on July 2, 2019."
Bluelene,225276-04T,01-Jan-2019,0.23,Actual,National Science Foundation,Grant,"The company received $225,000 of grant funding from National Science Foundation in approximately 2019."
Bluelene,252275-77T,08-Aug-2023,0.09,Actual,,Grant,"The company received $90,000 of grant funding from an undisclosed grantor on August 8, 2023."
Bolston Technology,168905-89T,01-Jan-2021,,,National Science Foundation Innovation Corps Program,Accelerator/Incubator,The company joined National Science Foundation Innovation Corps Program as a part of NSF I-Corps Winter Cohort in January 2021.
BTU Insight,132603-22T,11-Jan-2019,,,Bethesda Green,Accelerator/Incubator,"The company joined Bethesda Green as a part of the 2019 cohort on January 11, 2019 and received an undisclosed amount of funding."
BTU Insight,132700-51T,01-Jan-2019,,,,Accelerator/Incubator,The company joined Mentor Capital Network as a part of the 2019 Cohort in 2019 and received an undisclosed amount of funding.
Caregiver Jobs Now,122699-26T,27-Apr-2017,0.01,Actual,Accelerate Baltimore,Accelerator/Incubator,"The company joined Accelerate Baltimore Aging 2.0 program on April 27, 2017 and received $5,000 in funding."
Caregiver Jobs Now,122702-32T,03-May-2018,0.01,Actual,Startup Runway Foundation,Grant,"The company received $10,000 of grant funding from Startup Runway Foundation on May 3, 2018. The funds will be used towards expanding into Tennessee."
Caregiver Jobs Now,122703-40T,03-Jan-2018,0.05,Actual,Points of Light Institute (Ayesha Khanna),Accelerator/Incubator,"The company graduated from Points of Light Institute as a part of Civic Accelerator on January 3, 2018."
Caregiver Jobs Now,122705-83T,19-Nov-2015,0.01,Actual,Halcyon Incubator,Accelerator/Incubator,"The company joined Halcyon Incubator on November 19, 2015 and received $10,000 in funding."
Caregiver Jobs Now,131682-88T,04-Sep-2018,,,Impact Assets,Early Stage VC,"The company raised an undisclosed amount of venture funding from ImpactAssets on September 4, 2018. The amount was originally raised in the form of convertible debt and subsequently converted into equity."
Caregiver Jobs Now,131684-32T,08-Mar-2018,,,Village Capital,Accelerator/Incubator,"The company joined Village Capital as a part of Health US 2018 cohort on March 8, 2018."
Caregiver Jobs Now,184375-09T,01-Jan-2021,,,,Out of Business,The company is no longer actively in business as of 2021.
Caregiver Jobs Now,197004-07T,,,,Blue Ridge Labs,Accelerator/Incubator,The company joined Blue Ridge Labs on an undisclosed date.
Caregiver Jobs Now,264143-89T,01-Jan-2017,,,American Underground,Accelerator/Incubator,The company joined American Underground as a part of its Black Founders Exchange 2017 Cohort in 2017.
CeleFlux,140075-92T,01-Jun-2020,0.22,Actual,National Science Foundation,Grant,"The company received $224,998 of grant funding from National Science Foundation on June 1, 2020."
CeleFlux,203851-54T,15-Sep-2020,0.30,Actual,,Grant,"The company received $298,531 of grant funding from National Institutes of Health on September 15, 2020."
CIDE KIC,177618-34T,06-Jul-2021,0.03,Actual,TEDCO,Early Stage VC,"The company raised $25,000 of Series AA venture funding from TEDCO on July 6, 2021, putting the company's pre-money valuation at $300,000."
CIDE KIC,224259-94T,01-Jan-2022,,,Mindgrub Ventures,Later Stage VC,The company raised an undisclosed amount of venture funding from Mindgrub Ventures in 2022.
Clearview360,45546-49T,,,,Johns Hopkins Technology Ventures,Accelerator/Incubator,The company joined Fast Forward at Johns Hopkins University on an undisclosed date.
Clearview360,195611-68T,01-Jan-2003,,,,Spin-Off,The company was spun out of Johns Hopkins Bloomberg School of Public Health in 2003.
Clearview360,251179-75T,04-Jan-2024,,,,Out of Business,"The company is no longer actively in business as of January 4, 2024."
CoapTech,94957-12T,29-Nov-2016,0.15,Actual,TEDCO,Accelerator/Incubator,"The company relieved $150,000 of grant funding from TEDCO as part of its Maryland Innovation Initiative on November 29, 2016."
CoapTech,94959-64T,24-Jul-2018,2.35,Actual,"National Institutes of Health, TEDCO, UM Ventures",Early Stage VC,"The company raised $2.35 million through a combination of Series A venture funding from TEDCO, UM Ventures and National Institutes of Health on July 24, 2018, putting the company's pre-money valuation at $16 million. Other undisclosed investors also participated in the round."
CoapTech,94960-18T,01-Jan-2017,0.23,Actual,National Institute of Diabetes and Digestive and Kidney Diseases,Grant,"The company received $225,000 of grant funding from National Institute of Diabetes and Digestive and Kidney Diseases in 2017."
CoapTech,115449-31T,01-Jan-2018,0.75,Actual,Baltimore Angels,Early Stage VC,"The company raised $750,000 of venture funding from Baltimore Angels and other undisclosed investors on January 1, 2018, putting the company's pre-money valuation at $4 million. The company plans to use the funding to support greater data gathering and put the itself in a more stable financial position as it begins looking for potential commercialization partners."
CoapTech,137471-86T,21-Oct-2019,1.46,Actual,National Institute of Diabetes and Digestive and Kidney Diseases,Grant,"The company received $1.46 million of grant funding from National Institute of Diabetes and Digestive and Kidney Diseases and other undisclosed grantors on October 21, 2019."
CoapTech,137471-95T,01-Jan-2018,0.20,Actual,National Institutes of Health,Grant,"The company received $200,000 of grant funding from National Institutes of Health in 2018."
CoapTech,155481-04T,28-Aug-2020,7.05,Actual,Hunniwell Lake Ventures (Daniel Teo),Early Stage VC,"The company raised $7.05 million of Series B venture funding in a deal led by Hunniwell Lake Ventures on August 28, 2020, putting the company's pre-money valuation at $19.5 million. Other undisclosed investors also invested in the round. The funds will be used by the company to enable R&D for the underlying PUMA system to be expanded to more uses for procedures in other hollow areas of the body. Out of the total funding $3.2 million was originally raised in the form of convertible debt which subsequently got converted into equity."
CoapTech,169452-10T,22-Sep-2020,1.83,Actual,National Institute of Diabetes and Digestive and Kidney Diseases,Grant,"The company received $1.83 million of grant funding from The National Institute of Diabetes and Digestive and Kidney Diseases on September 22, 2020. Other undisclosed grantors also participated in this round. The company intends to use the funding to clinically evaluate the Pediatric PUMA-G System in collaboration with three premier pediatric medical centers: NewYork-Presbyterian Morgan Stanley Children's Hospital, Children's Hospital of Philadelphia (CHOP), and Children's National Hospital of Washington, DC."
CoapTech,193332-07T,01-Jan-2017,,,Dingman Center Angels,Angel (individual),The company raised an undisclosed amount of angel funding from Dingman Center Angels in 2017.
CoapTech,193332-43T,27-Jan-2022,0.05,Actual,Pennsylvania Pediatric Medical Device Consortium,Grant,"The company received $50,000 of grant funding from Pennsylvania Pediatric Medical Device Consortium on January 27, 2022."
CoapTech,203916-97T,15-Sep-2017,0.59,Actual,,Grant,"The company received a $590,458 grant from National Institutes of Health on September 15, 2017."
CoapTech,204013-00T,20-Sep-2019,0.77,Actual,,Grant,"The company received a $774,058 grant from National Institutes of Health on September 20, 2019."
CoapTech,219901-60T,04-Apr-2023,3.00,Actual,,Debt - General,"The company received $3 million of debt financing in the form of a loan from undisclosed lenders on April 4, 2023. The company will use the funds to expand its ranks and accelerate product development."
CoapTech,228451-15T,11-Jul-2023,,,Good Growth Capital,Later Stage VC,"The company raised $12.3 million of venture funding in the form of convertible debt from Good Growth Capital on July 11, 2023. Subsequently the deal was converted into equity."
CoapTech,232863-40T,04-Sep-2024,11.07,Actual,"Ecphora Capital, Good Growth Capital, New Day Venture Capital",Later Stage VC,"The company raised $11.07 million of venture funding in the form of convertible debt from Ecphora Capital, New Day Venture Capital, and Good Growth Capital on September 4, 2024. Subsequently the deal was converted into equity."
CoapTech,235873-00T,31-Dec-2020,0.10,Actual,The National Endowment for the Arts,Grant,"The company received $100,000 of grant funding from The National Endowment for the Arts on December 31, 2020."
CoapTech,248073-04T,01-Jun-2019,,,MedTech Innovator,Accelerator/Incubator,"The company joined MedTech Innovator on June 1, 2019."
Cogwear,173110-78T,18-Jun-2020,0.01,Actual,Ben Franklin Technology Partners of Southeastern Pennsylvania,Grant,"The company received $10,000 of grant funding from Ben Franklin Technology Partner of Southeastern Pennsylvania on June 18, 2020."
Cogwear,242271-64T,31-Oct-2021,0.26,Actual,National Science Foundation,Grant,"The company received $256,000 of grant funding from National Science Foundation on October 31, 2021."
Cogwear,254779-48T,19-Oct-2018,,,Endless Frontier Labs,Accelerator/Incubator,"The company joined Endless Frontier Labs on October 19, 2018."
Cogwear,263904-58T,01-Jan-2018,,,Creative Destruction Lab,Accelerator/Incubator,The company joined Creative Destruction Lab as a part of 2018/19 cohort.
Cogwear,265074-85T,30-Nov-2022,0.50,Actual,,Seed Round,"The company raised $500,006 of Seed funding from undisclosed investors on November 30, 2022, putting the company's pre-money valuation at $5.00 million."
Cogwear,265074-94T,07-Mar-2024,0.40,Actual,,Later Stage VC,"The company is in the process of raising $ 400,000 of an undisclosed targeted amount of venture funding in the form of convertible debt on March 7, 2024."
Cogwear,265960-54T,30-Jun-2024,0.22,Actual,,Grant,"The company received $221,000 of grant funding from an undisclosed grantor on June 30, 2024."
Cogwear,270712-27T,,,,,Later Stage VC,The company announced it will raise an undisclosed amount of venture funding in the form of convertible debt on an undisclosed date.
Coordle,224492-59T,21-Mar-2023,0.01,Actual,Loyola College Maryland Endowment,Accelerator/Incubator,"The company joined Loyola College Maryland Endowment on March 21, 2023 and received $5,500 in funding in the form of grant."
Coordle,244472-95T,29-Sep-2023,0.12,Actual,Techstars,Accelerator/Incubator,"The company joined Techstars as a part of Techstars Detroit powered by J.P. Morgan on September 29, 2023 and received $120,000 in funding. Out of the total amount $100,000 was received in the form of convertible debt."
Coordle,244474-21T,11-May-2023,0.01,Actual,Salisbury University,Grant,"The company was awarded a $5,000 prize from Salisbury University on May 11, 2023."
Coordle,258298-21T,01-Jan-2023,,,DigitalUndivided,Accelerator/Incubator,The company joined DigitalUndivided in 2023. No equity or funding was exchanged as a result of this program.
Coordle,258306-94T,22-Jan-2024,,,,Accelerator/Incubator,"The company joined SXSW as a part of SXSW Pitch 2024 on January 22, 2024. No equity or funding was exchanged as a result of this program."
Corduroy Diagnostics,85501-99T,,,,,Out of Business,The company is no longer actively in business.
CurieDx,244212-31T,01-Oct-2023,0.55,Actual,National Science Foundation,Grant,"The company received $550,000 of grant funding from National Science Foundation on October 1, 2023."
CurieDx,248487-49T,31-May-2023,,,National Science Foundation,Grant,"The company received an undisclosed amount of grant funding from National Science Foundation on May 31, 2023."
CurieDx,265866-04T,25-Jun-2024,1.30,Actual,GrowthX Capital,Early Stage VC,The company raised $1.3 million of venture funding from GrowthX Capital and other undisclosed investors.
CurieDx,265866-85T,,0.40,Estimated,TEDCO,Seed Round,"The company raised $400,000 of venture funding from TEDCO on an undisclosed date."
CurieDx,265869-28T,15-Sep-2023,,,Springboard Enterprises (Natalie Buford-Young),Accelerator/Incubator,"The company joined Springboard Enterprises as a part of Digital Health Program Cohort on September 15, 2023."
CurieDx,265876-84T,13-Jul-2023,0.05,Actual,Microsoft (NAS: MSFT),Accelerator/Incubator,"The company joined Microsoft as a part of Startups program on July 13, 2023 and received $50,000 funding in the form of grant."
CurieDx,265877-65T,13-May-2022,,,Johns Hopkins Technology Ventures,Accelerator/Incubator,"The company joined Johns Hopkins Technology Ventures Hexcite medical software start-up generator program on May 13, 2022."
CurieDx,265879-72T,01-Jan-2022,0.98,Actual,Johns Hopkins Technology Ventures,Grant,"The company received $980,000 of grant funding from Johns Hopkins Technology Ventures as a part of Biscotti Foundation Translational Funding on in 2022."
CurieDx,266503-15T,01-Jan-2022,0.30,Actual,,Seed Round,"The company raised $300,000 of pre-seed funding from undisclosed investors in January 2022."
CurieDx,274651-93T,01-Jan-2021,,,Ignite Healthcare Network,Accelerator/Incubator,The company joined Ignite Healthcare Network as a part of its 2021 Cohort. No equity or funding was exchanged as a result of this program.
Cursive (Educational Software),254159-02T,29-Jul-2023,0.01,Estimated,TERP Startup Laboratory,Accelerator/Incubator,"The company joined TERP Startup Laboratory on July 29, 2023 and received $5,000 in funding."
Cursive (Educational Software),270373-51T,21-Aug-2024,,,,Seed Round,"The company is in the process of raising pre-seed funding on August 21, 2024."
Custom Spray Solutions,81994-87T,04-Jul-2012,0.05,Actual,National Science Foundation Innovation Corps Program,Grant,"The company received $50,000 of grant funding from National Science Foundation Innovation Corps Program on July 4, 2014."
Custom Spray Solutions,81996-76T,,2.50,Actual,,Angel (individual),The company raised $2.5 million of angel funding on an undisclosed date.
Custom Spray Solutions,288049-24T,,,,UM Ventures,Accelerator/Incubator,The company joined UM Ventures on an undisclosed date. No equity or funding was exchanged as a result of this program.
Custom Spray Solutions,288049-78T,15-Mar-2025,,,,Out of Business,"The company is no longer actively in business as of March 15, 2025."
Cyberstanc,256267-72T,01-Oct-2020,,,MACH37,Accelerator/Incubator,The company joined MACH37 as part of the Fall 2020 Cohort in October 2020. No equity or funding was exchanged as a result of this program.
Cyberstanc,256267-81T,,,,CySecK,Accelerator/Incubator,The company joined CySecK on an undisclosed date. No equity or funding was exchanged as a result of this program.
Cyberstanc,256267-90T,,,,NASSCOM DeepTech Club,Accelerator/Incubator,The company joined NASSCOM DeepTech Club on an undisclosed date. No equity or funding was exchanged as a result of this program.
Cyberstanc,256267-99T,,,,KIIT Technology Business Incubator KIIT-TBI,Accelerator/Incubator,The company joined KIIT Technology Business Incubator KIIT-TBI on an undisclosed date. No equity or funding was exchanged as a result of this program.
Cyberstanc,284628-52T,,,,Cybersecurity Centre of Excellence,Accelerator/Incubator,The company joined Cybersecurity Centre of Excellence on an undisclosed date. No equity or funding was exchanged as a result of this program.
Cykloburn Technologies,113631-22T,01-Jul-2018,0.23,Actual,National Science Foundation,Grant,"The company received $225,000 of SBIR Phase I grant from National Science Foundation in July 2018."
Cykloburn Technologies,113632-57T,,0.15,Actual,TEDCO,Grant,"The company received $150,000 of Stage I grant from TEDCO on an undisclosed date."
Cykloburn Technologies,113632-93T,,0.10,Actual,Maryland Industrial Partnerships,Grant,"The company was awarded $100,000 of grant from Maryland Industrial Partnerships on an undisclosed date."
Cykloburn Technologies,113634-46T,01-Jan-2018,,,VentureWell,Accelerator/Incubator,The company joined VentureWell as part of the Environmental Health cohort 2018.
